poem_name,author,poem_content
行宫,元稹,寥落古行宫，宫花寂寞红。白头宫女在，闲坐说玄宗。锦水东北流，波荡双鸳鸯。雄巢汉宫树，雌弄秦草芳。宁同万死碎绮翼，不忍云间两分张。此时阿娇正娇妒，独坐长门愁日暮。但愿君恩顾妾深，岂惜黄金买词赋。相如作赋得黄金，丈夫好新多异心。一朝将聘茂陵女，文君因赠白头吟。东流不作西归水，落花辞条归故林。兔丝固无情，随风任倾倒。谁使女萝枝，而来强萦抱。两草犹一心，人心不如草。莫卷龙须席，从他生网丝。且留琥珀枕，或有梦来时。覆水再收岂满杯，弃妾已去难重回。古来得意不相负，只今惟见青陵台。妾发初覆额，折花门前剧。郎骑竹马来，绕床弄青梅。同居长干里，两小无嫌猜，十四为君妇，羞颜未尝开。低头向暗壁，千唤不一回。十五始展眉，愿同尘与灰。常存抱柱信，岂上望夫台。十六君远行，瞿塘滟滪堆。五月不可触，猿声天上哀。门前迟行迹，一一生绿苔。苔深不能扫，落叶秋风早。八月胡蝶黄，双飞西园草。(胡蝶 一作：蝴蝶)感此伤妾心，坐愁红颜老。早晚下三巴，预将书报家。相迎不道远，直至长风沙。忆妾深闺里，烟尘不曾识。嫁与长干人，沙头候风色。五月南风兴，思君下巴陵。八月西风起，想君发扬子。去来悲如何，见少离别多。湘潭几日到，妾梦越风波。昨夜狂风度，吹折江头树。淼淼暗无边，行人在何处。好乘浮云骢，佳期兰渚东。鸳鸯绿蒲上，翡翠锦屏中。自怜十五余，颜色桃花红。那作商人妇，愁水复愁风。吾爱孟夫子，风流天下闻。红颜弃轩冕，白首卧松云。 醉月频中圣，迷花不事君。高山安可仰，徒此揖清芬。
登鹳雀楼,王之涣,白日依山尽，黄河入海流。欲穷千里目，更上一层楼。问余何意栖碧山，笑而不答心自闲。桃花流水窅然去，别有天地非人间。金井梧桐秋叶黄，珠帘不卷夜来霜。熏笼玉枕无颜色，卧听南宫清漏长。高殿秋砧响夜阑，霜深犹忆御衣寒。银灯青琐裁缝歇，还向金城明主看。奉帚平明金殿开，暂将团扇共徘徊。玉颜不及寒鸦色，犹带昭阳日影来。真成薄命久寻思，梦见君王觉后疑。火照西宫知夜饮，分明复道奉恩时。长信宫中秋月明，昭阳殿下捣衣声。白露堂中细草迹，红罗帐里不胜情。绕池闲步看鱼游，正值儿童弄钓舟。 一种爱鱼心各异，我来施食尔垂钩。
新嫁娘词,王建,三日入厨下，洗手作羹汤。未谙姑食性，先遣小姑尝。端午临中夏，时清日复长。盐梅已佐鼎，曲糵且传觞。事古人留迹，年深缕积长。当轩知槿茂，向水觉芦香。亿兆同归寿，群公共保昌。忠贞如不替，贻厥后昆芳。休遣玲珑唱我诗，我诗多是别君词。明朝又向江头别，月落潮平是去时。人谁不顾老，老去有谁怜。身瘦带频减，发稀冠自偏。废书缘惜眼，多灸为随年。经事还谙事，阅人如阅川。细思皆幸矣，下此便翛然。莫道桑榆晚，为霞尚满天。
相思,王维,红豆生南国，春来发几枝。愿君多采撷，此物最相思。宜阳城下草萋萋，涧水东流复向西。 芳树无人花自落，春山一路鸟空啼。白酒新熟山中归，黄鸡啄黍秋正肥。呼童烹鸡酌白酒，儿女嬉笑牵人衣。高歌取醉欲自慰，起舞落日争光辉。游说万乘苦不早，著鞭跨马涉远道。会稽愚妇轻买臣，余亦辞家西入秦。仰天大笑出门去，我辈岂是蓬蒿人。前不见古人，后不见来者。念天地之悠悠，独怆然而涕下！
杂诗,王维,君自故乡来，应知故乡事。来日绮窗前，寒梅著花未？车辚辚，马萧萧，行人弓箭各在腰。耶娘妻子走相送，尘埃不见咸阳桥。(耶娘 一作：爷娘)牵衣顿足拦道哭，哭声直上干云霄。道旁过者问行人，行人但云点行频。或从十五北防河，便至四十西营田。去时里正与裹头，归来头白还戍边。边庭流血成海水，武皇开边意未已。君不闻，汉家山东二百州，千村万落生荆杞。纵有健妇把锄犁，禾生陇亩无东西。况复秦兵耐苦战，被驱不异犬与鸡。长者虽有问，役夫敢申恨？且如今年冬，未休关西卒。县官急索租，租税从何出？信知生男恶，反是生女好。生女犹得嫁比邻，生男埋没随百草。君不见，青海头，古来白骨无人收。新鬼烦冤旧鬼哭，天阴雨湿声啾啾！　　永州之野产异蛇：黑质而白章，触草木尽死；以啮人，无御之者。然得而腊之以为饵，可以已大风、挛踠、瘘疠，去死肌，杀三虫。其始太医以王命聚之，岁赋其二。募有能捕之者，当其租入。永之人争奔走焉。 　　有蒋氏者，专其利三世矣。问之，则曰：“吾祖死于是，吾父死于是，今吾嗣为之十二年，几死者数矣。”言之貌若甚戚者。余悲之，且曰：“若毒之乎？余将告于莅事者，更若役，复若赋，则何如？”蒋氏大戚，汪然出涕，曰：“君将哀而生之乎？则吾斯役之不幸，未若复吾赋不幸之甚也。向吾不为斯役，则久已病矣。自吾氏三世居是乡，积于今六十岁矣。而乡邻之生日蹙，殚其地之出，竭其庐之入。号呼而转徙，饥渴而顿踣。触风雨，犯寒暑，呼嘘毒疠，往往而死者，相藉也。曩与吾祖居者，今其室十无一焉。与吾父居者，今其室十无二三焉。与吾居十二年者，今其室十无四五焉。非死则徙尔，而吾以捕蛇独存。悍吏之来吾乡，叫嚣乎东西，隳突乎南北；哗然而骇者，虽鸡狗不得宁焉。吾恂恂而起，视其缶，而吾蛇尚存，则弛然而卧。谨食之，时而献焉。退而甘食其土之有，以尽吾齿。盖一岁之犯死者二焉，其余则熙熙而乐，岂若吾乡邻之旦旦有是哉。今虽死乎此，比吾乡邻之死则已后矣，又安敢毒耶？” 　　余闻而愈悲，孔子曰：“苛政猛于虎也！”吾尝疑乎是，今以蒋氏观之，犹信。呜呼！孰知赋敛之毒有甚是蛇者乎！故为之说，以俟夫观人风者得焉。　　（饥渴而顿踣 一作：饿渴）兰若生春夏，芊蔚何青青。幽独空林色，朱蕤冒紫茎。迟迟白日晚，袅袅秋风生。岁华尽摇落，芳意竟何成。
鹿柴,王维,空山不见人，但闻人语响。返景入深林，复照青苔上。三年谪宦此栖迟，万古惟留楚客悲。秋草独寻人去后，寒林空见日斜时。汉文有道恩犹薄，湘水无情吊岂知？寂寂江山摇落处，怜君何事到天涯！南浦凄凄别，西风袅袅秋。一看肠一断，好去莫回头。八岁偷照镜，长眉已能画。十岁去踏青，芙蓉作裙衩。十二学弹筝，银甲不曾卸。十四藏六亲，悬知犹未嫁。十五泣春风，背面秋千下。
竹里馆,王维,独坐幽篁里，弹琴复长啸。深林人不知，明月来相照。今夜鄜州月，闺中只独看。遥怜小儿女，未解忆长安。香雾云鬟湿，清辉玉臂寒。何时倚虚幌，双照泪痕干。行子对飞蓬，金鞭指铁骢。功名万里外，心事一杯中。虏障燕支北，秦城太白东。离魂莫惆怅，看取宝刀雄！桂魄初生秋露微，轻罗已薄未更衣。银筝夜久殷勤弄，心怯空房不忍归。
山中送别,王维,山中相送罢，日暮掩柴扉。春草明年绿，王孙归不归？(明年 一作：年年)飞光飞光，劝尔一杯酒。吾不识青天高，黄地厚。唯见月寒日暖，来煎人寿。食熊则肥，食蛙则瘦。神君何在？太一安有？天东有若木，下置衔烛龙。吾将斩龙足，嚼龙肉，使之朝不得回，夜不得伏。自然老者不死，少者不哭。何为服黄金、吞白玉？谁似任公子，云中骑碧驴？刘彻茂陵多滞骨，嬴政梓棺费鲍鱼。　　浩浩乎，平沙无垠，夐不见人。河水萦带，群山纠纷。黯兮惨悴，风悲日曛。蓬断草枯，凛若霜晨。鸟飞不下，兽铤亡群。亭长告余曰：“此古战场也，常覆三军。往往鬼哭，天阴则闻。”伤心哉！秦欤汉欤？将近代欤？　　吾闻夫齐魏徭戍，荆韩召募。万里奔走，连年暴露。沙草晨牧，河冰夜渡。地阔天长，不知归路。寄身锋刃，腷臆谁愬？秦汉而还，多事四夷，中州耗斁，无世无之。古称戎夏，不抗王师。文教失宣，武臣用奇。奇兵有异于仁义，王道迂阔而莫为。呜呼噫嘻！　　吾想夫北风振漠，胡兵伺便。主将骄敌，期门受战。野竖旌旗，川回组练。法重心骇，威尊命贱。利镞穿骨，惊沙入面，主客相搏，山川震眩。声析江河，势崩雷电。至若穷阴凝闭，凛冽海隅，积雪没胫，坚冰在须。鸷鸟休巢，征马踟蹰。缯纩无温，堕指裂肤。当此苦寒，天假强胡，凭陵杀气，以相剪屠。径截辎重，横攻士卒。都尉新降，将军复没。尸踣巨港之岸，血满长城之窟。无贵无贱，同为枯骨。可胜言哉！鼓衰兮力竭，矢尽兮弦绝，白刃交兮宝刀折，两军蹙兮生死决。降矣哉，终身夷狄；战矣哉，暴骨沙砾。鸟无声兮山寂寂，夜正长兮风淅淅。魂魄结兮天沉沉，鬼神聚兮云幂幂。日光寒兮草短，月色苦兮霜白。伤心惨目，有如是耶！　　吾闻之：牧用赵卒，大破林胡，开地千里，遁逃匈奴。汉倾天下，财殚力痡。任人而已，岂在多乎！周逐猃狁，北至太原。既城朔方，全师而还。饮至策勋，和乐且闲。穆穆棣棣，君臣之间。秦起长城，竟海为关。荼毒生民，万里朱殷。汉击匈奴，虽得阴山，枕骸徧野，功不补患。　　苍苍蒸民，谁无父母？提携捧负，畏其不寿。谁无兄弟？如足如手。谁无夫妇？如宾如友。生也何恩，杀之何咎？其存其没，家莫闻知。人或有言，将信将疑。悁悁心目，寤寐见之。布奠倾觞，哭望天涯。天地为愁，草木凄悲。吊祭不至，精魂无依。必有凶年，人其流离。呜呼噫嘻！时耶命耶？从古如斯！为之奈何？守在四夷。 荷叶生时春恨生，荷叶枯时秋恨成。 深知身在情长在，怅望江头江水声。
问刘十九,白居易,绿蚁新醅酒，红泥小火炉。晚来天欲雪，能饮一杯无？小时不识月，呼作白玉盘。又疑瑶台镜，飞在青云端。(青云 一作：白云)仙人垂两足，桂树何团团。白兔捣药成，问言与谁餐？蟾蜍蚀圆影，大明夜已残。羿昔落九乌，天人清且安。阴精此沦惑，去去不足观。忧来其如何？凄怆摧心肝。二十年来万事同，今朝岐路忽西东。皇恩若许归田去，晚岁当为邻舍翁。千里莺啼绿映红，水村山郭酒旗风。南朝四百八十寺，多少楼台烟雨中。
哥舒歌,西鄙人,北斗七星高，哥舒夜带刀。至今窥牧马，不敢过临洮。船动湖光滟滟秋，贪看年少信船流。无端隔水抛莲子，遥被人知半日羞。天街小雨润如酥，草色遥看近却无。最是一年春好处，绝胜烟柳满皇都。一树春风千万枝，嫩于金色软于丝。 永丰西角荒园里，尽日无人属阿谁？
静夜思,李白,床前明月光，疑是地上霜。举头望明月，低头思故乡。春风倚棹阖闾城，水国春寒阴复晴。细雨湿衣看不见，闲花落地听无声。日斜江上孤帆影，草绿湖南万里情。东道若逢相识问，青袍今已误儒生。纤云四卷天无河，清风吹空月舒波。沙平水息声影绝，一杯相属君当歌。君歌声酸辞且苦，不能听终泪如雨。洞庭连天九疑高，蛟龙出没猩鼯号。十生九死到官所，幽居默默如藏逃。下床畏蛇食畏药，海气湿蛰熏腥臊。昨者州前捶大鼓，嗣皇继圣登夔皋。赦书一日行万里，罪从大辟皆除死。迁者追回流者还，涤瑕荡垢清朝班。州家申名使家抑，坎轲只得移荆蛮。判司卑官不堪说，未免捶楚尘埃间。同时辈流多上道，天路幽险难追攀。君歌且休听我歌，我歌今与君殊科。一年明月今宵多，人生由命非由他。有酒不饮奈明何。秦王扫六合，虎视何雄哉！挥剑决浮云，诸侯尽西来。明断自天启，大略驾群才。收兵铸金人，函谷正东开。铭功会稽岭，骋望琅琊台。刑徒七十万，起土骊山隈。尚采不死药，茫然使心哀。连弩射海鱼，长鲸正崔嵬。额鼻象五岳，扬波喷云雷。鬐鬣蔽青天，何由睹蓬莱？徐氏载秦女，楼船几时回？但见三泉下，金棺葬寒灰。
怨情,李白,美人卷珠帘，深坐蹙蛾眉。(蹙 一作：颦)但见泪痕湿，不知心恨谁。世间荣落重逡巡，我独丘园坐四春。纵使有花兼有月，可堪无酒又无人。青袍似草年年定，白发如丝日日新。欲逐风波千万里，未知何路到龙津。肃肃凉风生，加我林壑清。驱烟寻涧户，卷雾出山楹。去来固无迹，动息如有情。日落山水静，为君起松声。(版本一)肃肃凉景生，加我林壑清。驱烟寻涧户，卷雾出山楹。去来固无迹，动息如有情。日落山水静，为君起松声。(版本二)寂寞天宝后，园庐但蒿藜。我里百余家，世乱各东西。存者无消息，死者为尘泥。贱子因阵败，归来寻旧蹊。久行见空巷，日瘦气惨凄，但对狐与狸，竖毛怒我啼。四邻何所有，一二老寡妻。宿鸟恋本枝，安辞且穷栖。方春独荷锄，日暮还灌畦。县吏知我至，召令习鼓鞞。虽从本州役，内顾无所携。近行止一身，远去终转迷。家乡既荡尽，远近理亦齐。永痛长病母，五年委沟溪。生我不得力，终身两酸嘶。人生无家别，何以为蒸黎。
登乐游原,李商隐,向晚意不适，驱车登古原。夕阳无限好，只是近黄昏。清瑟怨遥夜，绕弦风雨哀。孤灯闻楚角，残月下章台。芳草已云暮，故人殊未来。乡书不可寄，秋雁又南回。落莫谁家子，来感长安秋。壮年抱羁恨，梦泣生白头。瘦马秣败草，雨沫飘寒沟。南宫古帘暗，湿景传签筹。家山远千里，云脚天东头。忧眠枕剑匣，客帐梦封侯。昔日龌龊不足夸，今朝放荡思无涯。 春风得意马蹄疾，一日看尽长安花。
听筝,李端,鸣筝金粟柱，素手玉房前。欲得周郎顾，时时误拂弦。　　浩浩乎，平沙无垠，夐不见人。河水萦带，群山纠纷。黯兮惨悴，风悲日曛。蓬断草枯，凛若霜晨。鸟飞不下，兽铤亡群。亭长告余曰：“此古战场也，常覆三军。往往鬼哭，天阴则闻。”伤心哉！秦欤汉欤？将近代欤？　　吾闻夫齐魏徭戍，荆韩召募。万里奔走，连年暴露。沙草晨牧，河冰夜渡。地阔天长，不知归路。寄身锋刃，腷臆谁愬？秦汉而还，多事四夷，中州耗斁，无世无之。古称戎夏，不抗王师。文教失宣，武臣用奇。奇兵有异于仁义，王道迂阔而莫为。呜呼噫嘻！　　吾想夫北风振漠，胡兵伺便。主将骄敌，期门受战。野竖旌旗，川回组练。法重心骇，威尊命贱。利镞穿骨，惊沙入面，主客相搏，山川震眩。声析江河，势崩雷电。至若穷阴凝闭，凛冽海隅，积雪没胫，坚冰在须。鸷鸟休巢，征马踟蹰。缯纩无温，堕指裂肤。当此苦寒，天假强胡，凭陵杀气，以相剪屠。径截辎重，横攻士卒。都尉新降，将军复没。尸踣巨港之岸，血满长城之窟。无贵无贱，同为枯骨。可胜言哉！鼓衰兮力竭，矢尽兮弦绝，白刃交兮宝刀折，两军蹙兮生死决。降矣哉，终身夷狄；战矣哉，暴骨沙砾。鸟无声兮山寂寂，夜正长兮风淅淅。魂魄结兮天沉沉，鬼神聚兮云幂幂。日光寒兮草短，月色苦兮霜白。伤心惨目，有如是耶！　　吾闻之：牧用赵卒，大破林胡，开地千里，遁逃匈奴。汉倾天下，财殚力痡。任人而已，岂在多乎！周逐猃狁，北至太原。既城朔方，全师而还。饮至策勋，和乐且闲。穆穆棣棣，君臣之间。秦起长城，竟海为关。荼毒生民，万里朱殷。汉击匈奴，虽得阴山，枕骸徧野，功不补患。　　苍苍蒸民，谁无父母？提携捧负，畏其不寿。谁无兄弟？如足如手。谁无夫妇？如宾如友。生也何恩，杀之何咎？其存其没，家莫闻知。人或有言，将信将疑。悁悁心目，寤寐见之。布奠倾觞，哭望天涯。天地为愁，草木凄悲。吊祭不至，精魂无依。必有凶年，人其流离。呜呼噫嘻！时耶命耶？从古如斯！为之奈何？守在四夷。 历览前贤国与家，成由勤俭破由奢。何须琥珀方为枕，岂得真珠始是车。远去不逢青海马，力穷难拔蜀山蛇。(远去 一作：运去)几人曾预南薰曲，终古苍梧哭翠华。秋荷一滴露，清夜坠玄天。将来玉盘上，不定始知圆。
渡汉江,宋之问,岭外音书断，经冬复历春。近乡情更怯，不敢问来人。钓罢归来不系船，江村月落正堪眠。纵然一夜风吹去，只在芦花浅水边。楚塞三湘接，荆门九派通。江流天地外，山色有无中。郡邑浮前浦，波澜动远空。襄阳好风日，留醉与山翁。紫陌红尘拂面来，无人不道看花回。玄都观里桃千树，尽是刘郎去后栽。
八阵图,杜甫,功盖三分国，名成八阵图。（名成 一作：名高）江流石不转，遗恨失吞吴。长江悲已滞，万里念将归。况属高风晚，山山黄叶飞。二龙争战决雌雄，赤壁楼船扫地空。烈火张天照云海，周瑜于此破曹公。君去沧江望澄碧，鲸鲵唐突留馀迹。一一书来报故人，我欲因之壮心魄。向晚意不适，驱车登古原。夕阳无限好，只是近黄昏。
宿建德江,孟浩然,移舟泊烟渚，日暮客愁新。野旷天低树，江清月近人。莫以今时宠，难忘旧日恩。看花满眼泪，不共楚王言。乌啼鹊噪昏乔木，清明寒食谁家哭。风吹旷野纸钱飞，古墓垒垒春草绿。棠梨花映白杨树，尽是死生别离处。(别离 一作：离别)冥冥重泉哭不闻，萧萧暮雨人归去。烟霄微月澹长空，银汉秋期万古同。 几许欢情与离恨，年年并在此宵中。
春晓,孟浩然,春眠不觉晓，处处闻啼鸟。夜来风雨声，花落知多少。　　白闻天下谈士相聚而言曰：“生不用封万户侯，但愿一识韩荆州。”何令人之景慕，一至于此耶！岂不以有周公之风，躬吐握之事，使海内豪俊，奔走而归之，一登龙门，则声价十倍！所以龙蟠凤逸之士，皆欲收名定价于君侯。愿君侯不以富贵而骄之、寒贱而忽之，则三千之中有毛遂，使白得颖脱而出，即其人焉。　　白，陇西布衣，流落楚、汉。十五好剑术，遍干诸侯。三十成文章，历抵卿相。虽长不满七尺，而心雄万夫。皆王公大人许与气义。此畴曩心迹，安敢不尽于君侯哉！　　君侯制作侔神明，德行动天地，笔参造化，学究天人。幸愿开张心颜，不以长揖见拒。必若接之以高宴，纵之以清谈，请日试万言，倚马可待。今天下以君侯为文章之司命，人物之权衡，一经品题，便作佳士。而君侯何惜阶前盈尺之地，不使白扬眉吐气，激昂青云耶？　　昔王子师为豫州，未下车，即辟荀慈明，既下车，又辟孔文举；山涛作冀州，甄拔三十余人，或为侍中、尚书，先代所美。而君侯亦荐一严协律，入为秘书郎，中间崔宗之、房习祖、黎昕、许莹之徒，或以才名见知，或以清白见赏。白每观其衔恩抚躬，忠义奋发，以此感激，知君侯推赤心于诸贤腹中，所以不归他人，而愿委身国士。傥急难有用，敢效微躯。　　且人非尧舜，谁能尽善？白谟猷筹画，安能自矜？至于制作，积成卷轴，则欲尘秽视听。恐雕虫小技，不合大人。若赐观刍荛，请给纸墨，兼之书人，然后退扫闲轩，缮写呈上。庶青萍、结绿，长价于薛、卞之门。幸惟下流，大开奖饰，惟君侯图之。南陵水面漫悠悠，风紧云轻欲变秋。正是客心孤迥处，谁家红袖凭江楼？怅卧新春白袷衣，白门寥落意多违。红楼隔雨相望冷，珠箔飘灯独自归。远路应悲春晼晚，残宵犹得梦依稀。玉珰缄札何由达，万里云罗一雁飞。
春怨,金昌绪,打起黄莺儿，莫教枝上啼。啼时惊妾梦，不得到辽西。天上白玉京，十二楼五城。仙人抚我顶，结发受长生。 误逐世间乐，颇穷理乱情。九十六圣君，浮云挂空名。 天地赌一掷，未能忘战争。试涉霸王略，将期轩冕荣。 时命乃大谬，弃之海上行。学剑翻自哂，为文竟何成。 剑非万人敌，文窃四海声。儿戏不足道，五噫出西京。 临当欲去时，慷慨泪沾缨。叹君倜傥才，标举冠群英。 开筵引祖帐，慰此远徂征。鞍马若浮云，送余骠骑亭。 歌钟不尽意，白日落昆明。十月到幽州，戈鋋若罗星。 君王弃北海，扫地借长鲸。呼吸走百川，燕然可摧倾。 心知不得语，却欲栖蓬瀛。弯弧惧天狼，挟矢不敢张。 揽涕黄金台，呼天哭昭王。无人贵骏骨，騄耳空腾骧。 乐毅倘再生，于今亦奔亡。蹉跎不得意，驱马还贵乡。 逢君听弦歌，肃穆坐华堂。百里独太古，陶然卧羲皇。 征乐昌乐馆，开筵列壶觞。贤豪间青娥，对烛俨成行。 醉舞纷绮席，清歌绕飞梁。欢娱未终朝，秩满归咸阳。 祖道拥万人，供帐遥相望。一别隔千里，荣枯异炎凉。 炎凉几度改，九土中横溃。汉甲连胡兵，沙尘暗云海。 草木摇杀气，星辰无光彩。白骨成丘山，苍生竟何罪。 函关壮帝居，国命悬哥舒。长戟三十万，开门纳凶渠。 公卿如犬羊，忠谠醢与菹。二圣出游豫，两京遂丘墟。 帝子许专征，秉旄控强楚。节制非桓文，军师拥熊虎。 人心失去就，贼势腾风雨。惟君固房陵，诚节冠终古。 仆卧香炉顶，餐霞漱瑶泉。门开九江转，枕下五湖连。 半夜水军来，浔阳满旌旃。空名适自误，迫胁上楼船。 徒赐五百金，弃之若浮烟。辞官不受赏，翻谪夜郎天。 夜郎万里道，西上令人老。扫荡六合清，仍为负霜草。 日月无偏照，何由诉苍昊。良牧称神明，深仁恤交道。 一忝青云客，三登黄鹤楼。顾惭祢处士，虚对鹦鹉洲。 樊山霸气尽，寥落天地秋。江带峨眉雪，川横三峡流。 万舸此中来，连帆过扬州。送此万里目，旷然散我愁。 纱窗倚天开，水树绿如发。窥日畏衔山，促酒喜得月。 吴娃与越艳，窈窕夸铅红。呼来上云梯，含笑出帘栊。 对客小垂手，罗衣舞春风。宾跪请休息，主人情未极。 览君荆山作，江鲍堪动色。清水出芙蓉，天然去雕饰。 逸兴横素襟，无时不招寻。朱门拥虎士，列戟何森森。 剪凿竹石开，萦流涨清深。登台坐水阁，吐论多英音。 片辞贵白璧，一诺轻黄金。谓我不愧君，青鸟明丹心。 五色云间鹊，飞鸣天上来。传闻赦书至，却放夜郎回。 暖气变寒谷，炎烟生死灰。君登凤池去，忽弃贾生才。 桀犬尚吠尧，匈奴笑千秋。中夜四五叹，常为大国忧。 旌旆夹两山，黄河当中流。连鸡不得进，饮马空夷犹。 安得羿善射，一箭落旄头。脉脉广川流，驱马历长洲。鹊飞山月曙，蝉噪野风秋。四月十七，正是去年今日，别君时。忍泪佯低面，含羞半敛眉。不知魂已断，空有梦相随。除却天边月，没人知。
江雪,柳宗元,千山鸟飞绝，万径人踪灭。孤舟蓑笠翁，独钓寒江雪。一双幽色出凡尘，数粒秋烟二尺鳞。 从此静窗闻细韵，琴声长伴读书人。此马非凡马，房星本是星。向前敲瘦骨，犹自带铜声。已讶衾枕冷，复见窗户明。夜深知雪重，时闻折竹声。
秋夜寄邱员外,韦应物,怀君属秋夜，散步咏凉天。空山松子落，幽人应未眠。(空山 一作：山空)人初生，日初出。上山迟，下山疾。百年三万六千朝，夜里分将强半日。有歌有舞须早为，昨日健于今日时。 人家见生男女好，不知男女催人老。短歌行，无乐声。羞日遮罗袖，愁春懒起妆。易求无价宝，难得有心郎。枕上潜垂泪，花间暗断肠。自能窥宋玉，何必恨王昌？秦王扫六合，虎视何雄哉！挥剑决浮云，诸侯尽西来。明断自天启，大略驾群才。收兵铸金人，函谷正东开。铭功会稽岭，骋望琅琊台。刑徒七十万，起土骊山隈。尚采不死药，茫然使心哀。连弩射海鱼，长鲸正崔嵬。额鼻象五岳，扬波喷云雷。鬐鬣蔽青天，何由睹蓬莱？徐氏载秦女，楼船几时回？但见三泉下，金棺葬寒灰。
