poem_name,author,poem_content
已凉,韩偓,碧阑干外绣帘垂，猩色屏风画折枝。 八尺龙须方锦褥，已凉天气未寒时。金河秋半虏弦开，云外惊飞四散哀。仙掌月明孤影过，长门灯暗数声来。须知胡骑纷纷在，岂逐春风一一回？莫厌潇湘少人处，水多菰米岸莓苔。兰叶春葳蕤，桂华秋皎洁。欣欣此生意，自尔为佳节。谁知林栖者，闻风坐相悦。草木有本心，何求美人折。幽人归独卧，滞虑洗孤清。持此谢高鸟，因之传远情。日夕怀空意，人谁感至精？飞沉理自隔，何所慰吾诚？鱼游乐深池，鸟栖欲高枝。嗟尔蜉蝣羽，薨薨亦何为。有生岂不化，所感奚若斯。神理日微灭，吾心安得知。浩叹杨朱子，徒然泣路岐。孤鸿海上来，池潢不敢顾。侧见双翠鸟，巢在三珠树。矫矫珍木巅，得无金丸惧？美服患人指，高明逼神恶？今我游冥冥，弋者何所慕！吴越数千里，梦寐今夕见。形骸非我亲，衾枕即乡县。化蝶犹不识，川鱼安可羡。海上有仙山，归期觉神变。西日下山隐，北风乘夕流。燕雀感昏旦，檐楹呼匹俦。鸿鹄虽自远，哀音非所求。贵人弃疵贱，下士尝殷忧。众情累外物，恕己忘内修。感叹长如此，使我心悠悠。江南有丹橘，经冬犹绿林。岂伊地气暖，自有岁寒心⑿。可以荐嘉客⒀，奈何阻重深。运命唯所遇，循环不可寻。徒言树桃李，此木岂无阴。永日徒离忧，临风怀蹇修。美人何处所，孤客空悠悠。青鸟跂不至，朱鳖谁云浮。夜分起踯躅，时逝曷淹留。抱影吟中夜，谁闻此叹息。美人适异方，庭树含幽色。白云愁不见，沧海飞无翼。凤凰一朝来，竹花斯可食。汉上有游女，求思安可得。袖中一札书，欲寄双飞翼。冥冥愁不见，耿耿徒缄忆。紫兰秀空蹊，皓露夺幽色。馨香岁欲晚，感叹情何极。白云在南山，日暮长太息。我有异乡忆，宛在云溶溶。凭此目不觏，要之心所钟。但欲附高鸟，安敢攀飞龙。至精无感遇，悲惋填心胸。归来扣寂寞，人愿天岂从？闭门迹群化，凭林结所思。啸叹此寒木，畴昔乃芳蕤。朝阳凤安在，日暮蝉独悲。浩思极中夜，深嗟欲待谁。所怀诚已矣，既往不可追。鼎食非吾事，云仙尝我期。胡越方杳杳，车马何迟迟。天壤一何异，幽嘿卧帘帷。 大鹏一日同风起，扶摇直上九万里。假令风歇时下来，犹能簸却沧溟水。时人见我恒殊调，闻余大言皆冷笑。(时人 一作：世人)宣父犹能畏后生，丈夫未可轻年少。
宫词,顾况,长乐宫连上苑春，玉楼金殿艳歌新。 君门一入无由出，唯有宫莺得见人。初闻征雁已无蝉，百尺楼高水接天。(楼高 一作：楼南 / 楼台)青女素娥俱耐冷，月中霜里斗婵娟。从来只有情难尽，何事名为情尽桥。自此改名为折柳，任他离恨一条条。元和十年，予左迁九江郡司马。明年秋，送客湓浦口，闻舟中夜弹琵琶者，听其音，铮铮然有京都声。问其人，本长安倡女，尝学琵琶于穆、曹二善才，年长色衰，委身为贾人妇。遂命酒，使快弹数曲。曲罢悯然，自叙少小时欢乐事，今漂沦憔悴，转徙于江湖间。予出官二年，恬然自安，感斯人言，是夕始觉有迁谪意。因为长句，歌以赠之，凡六百一十六言，命曰《琵琶行》。浔阳江头夜送客，枫叶荻花秋瑟瑟。主人下马客在船，举酒欲饮无管弦。醉不成欢惨将别，别时茫茫江浸月。忽闻水上琵琶声，主人忘归客不发。寻声暗问弹者谁，琵琶声停欲语迟。移船相近邀相见，添酒回灯重开宴。千呼万唤始出来，犹抱琵琶半遮面。转轴拨弦三两声，未成曲调先有情。弦弦掩抑声声思，似诉平生不得志。低眉信手续续弹，说尽心中无限事。轻拢慢捻抹复挑，初为《霓裳》后《六幺》。(六幺 一作：绿腰)大弦嘈嘈如急雨，小弦切切如私语。嘈嘈切切错杂弹，大珠小珠落玉盘。间关莺语花底滑，幽咽泉流冰下难。冰泉冷涩弦凝绝，凝绝不通声暂歇。(暂歇 一作：渐歇)别有幽愁暗恨生，此时无声胜有声。银瓶乍破水浆迸，铁骑突出刀枪鸣。曲终收拨当心画，四弦一声如裂帛。东船西舫悄无言，唯见江心秋月白。沉吟放拨插弦中，整顿衣裳起敛容。自言本是京城女，家在虾蟆陵下住。十三学得琵琶成，名属教坊第一部。曲罢曾教善才服，妆成每被秋娘妒。(服 一作：伏)五陵年少争缠头，一曲红绡不知数。钿头银篦击节碎，血色罗裙翻酒污。(银篦 一作：云篦)今年欢笑复明年，秋月春风等闲度。弟走从军阿姨死，暮去朝来颜色故。门前冷落鞍马稀，老大嫁作商人妇。商人重利轻别离，前月浮梁买茶去。去来江口守空船，绕船月明江水寒。夜深忽梦少年事，梦啼妆泪红阑干。我闻琵琶已叹息，又闻此语重唧唧。同是天涯沦落人，相逢何必曾相识！我从去年辞帝京，谪居卧病浔阳城。浔阳地僻无音乐，终岁不闻丝竹声。住近湓江地低湿，黄芦苦竹绕宅生。其间旦暮闻何物？杜鹃啼血猿哀鸣。春江花朝秋月夜，往往取酒还独倾。岂无山歌与村笛，呕哑嘲哳难为听。今夜闻君琵琶语，如听仙乐耳暂明。莫辞更坐弹一曲，为君翻作《琵琶行》。感我此言良久立，却坐促弦弦转急。凄凄不似向前声，满座重闻皆掩泣。座中泣下谁最多？江州司马青衫湿。
送杜少府之任蜀州,王勃,城阙辅三秦，风烟望五津。与君离别意，同是宦游人。海内存知己，天涯若比邻。无为在歧路，儿女共沾巾。二龙争战决雌雄，赤壁楼船扫地空。烈火张天照云海，周瑜于此破曹公。君去沧江望澄碧，鲸鲵唐突留馀迹。一一书来报故人，我欲因之壮心魄。北斗七星高，哥舒夜带刀。至今窥牧马，不敢过临洮。水国蒹葭夜有霜，月寒山色共苍苍。 谁言千里自今夕，离梦杳如关塞长。
送梓州李使君,王维,万壑树参天，千山响杜鹃。山中一夜雨，树杪百重泉。汉女输橦布，巴人讼芋田。文翁翻教授，不敢倚先贤。有美一人兮，婉如青扬。识曲别音兮，令姿煌煌。 绣袂捧琴兮，登君子堂。如彼萱草兮，使我忧忘。 欲赠之以紫玉尺，白银铛。久不见之兮，湘水茫茫。木末芙蓉花，山中发红萼。涧户寂无人，纷纷开且落。冰簟银床梦不成，碧天如水夜云轻。 雁声远过潇湘去，十二楼中月自明。
汉江临眺,王维,楚塞三湘接，荆门九派通。江流天地外，山色有无中。郡邑浮前浦，波澜动远空。襄阳好风日，留醉与山翁。寒山吹笛唤春归，迁客相看泪满衣。 洞庭一夜无穷雁，不待天明尽北飞。孤雁不饮啄，飞鸣声念群。谁怜一片影，相失万重云？望尽似犹见，哀多如更闻。野鸦无意绪，鸣噪自纷纷。天际霞光入水中，水中天际一时红。直须日观三更后，首送金乌上碧空。
终南别业,王维,中岁颇好道，晚家南山陲。兴来每独往，胜事空自知。行到水穷处，坐看云起时。偶然值林叟，谈笑无还期。望君烟水阔，挥手泪沾巾。飞鸟没何处，青山空向人。长江一帆远，落日五湖春。谁见汀洲上，相思愁白蘋。积雨空林烟火迟，蒸藜炊黍饷东菑。漠漠水田飞白鹭，阴阴夏木啭黄鹂。山中习静观朝槿，松下清斋折露葵。野老与人争席罢，海鸥何事更相疑。堂前扑枣任西邻，无食无儿一妇人。不为困穷宁有此？只缘恐惧转须亲。即防远客虽多事，便插疏篱却甚真。已诉征求贫到骨，正思戎马泪盈巾。
终南山,王维,太乙近天都，连山接海隅。(接 一作：到)白云回望合，青霭入看无。分野中峰变，阴晴众壑殊。欲投人处宿，隔水问樵夫。白酒新熟山中归，黄鸡啄黍秋正肥。呼童烹鸡酌白酒，儿女嬉笑牵人衣。高歌取醉欲自慰，起舞落日争光辉。游说万乘苦不早，著鞭跨马涉远道。会稽愚妇轻买臣，余亦辞家西入秦。仰天大笑出门去，我辈岂是蓬蒿人。绿野堂开占物华，路人指道令公家。令公桃李满天下，何用堂前更种花。言入黄花川，每逐青溪水。随山将万转，趣途无百里。声喧乱石中，色静深松里。漾漾泛菱荇，澄澄映葭苇。我心素已闲，清川澹如此。请留磐石上，垂钓将已矣。(磐石 一作：盘石)
酬张少府,王维,晚年唯好静，万事不关心。自顾无长策，空知返旧林。松风吹解带，山月照弹琴。君问穷通理，渔歌入浦深。吟君叹逝双绝句，使我伤怀奏短歌。世上空惊故人少，集中惟觉祭文多。芳林新叶催陈叶，流水前波让后波。万古到今同此恨，闻琴泪尽欲如何。冰簟银床梦不成，碧天如水夜云轻。 雁声远过潇湘去，十二楼中月自明。洛阳城里见秋风，欲作家书意万重。复恐匆匆说不尽，行人临发又开封。
过香积寺,王维,不知香积寺，数里入云峰。古木无人径，深山何处钟。泉声咽危石，日色冷青松。薄暮空潭曲，安禅制毒龙。碧玉妆成一树高，万条垂下绿丝绦。不知细叶谁裁出，二月春风似剪刀。日出扶桑一丈高，人间万事细如毛。 野夫怒见不平处，磨损胸中万古刀。群山万壑赴荆门，生长明妃尚有村。一去紫台连朔漠，独留青冢向黄昏。画图省识春风面，环珮空归夜月魂。(夜月 一作：月夜)千载琵琶作胡语，分明怨恨曲中论。
辋川闲居赠裴秀才迪,王维,寒山转苍翠，秋水日潺湲。倚杖柴门外，临风听暮蝉。渡头馀落日，墟里上孤烟。(馀 一作 余)复值接舆醉，狂歌五柳前。小时不识月，呼作白玉盘。又疑瑶台镜，飞在青云端。(青云 一作：白云)仙人垂两足，桂树何团团。白兔捣药成，问言与谁餐？蟾蜍蚀圆影，大明夜已残。羿昔落九乌，天人清且安。阴精此沦惑，去去不足观。忧来其如何？凄怆摧心肝。山寺钟鸣昼已昏，渔梁渡头争渡喧。人随沙岸向江村，余亦乘舟归鹿门。鹿门月照开烟树，忽到庞公栖隐处。岩扉松径长寂寥，惟有幽人自来去。大鹏飞兮振八裔，中天摧兮力不济。馀风激兮万世，游扶桑兮挂左袂。(左袂 一作：石袂)后人得之传此，仲尼亡兮谁为出涕。
山居秋暝,王维,空山新雨后，天气晚来秋。明月松间照，清泉石上流。竹喧归浣女，莲动下渔舟。随意春芳歇，王孙自可留。菱透浮萍绿锦池，夏莺千啭弄蔷薇。尽日无人看微雨，鸳鸯相对浴红衣。枫叶千枝复万枝，江桥掩映暮帆迟。 忆君心似西江水，日夜东流无歇时。竹帛烟销帝业虚，关河空锁祖龙居。坑灰未冷山东乱，刘项原来不读书。
归嵩山作,王维,清川带长薄，车马去闲闲。流水如有意，暮禽相与还。荒城临古渡，落日满秋山。迢递嵩高下，归来且闭关。松下问童子，言师采药去。只在此山中，云深不知处。胡人吹笛戍楼间，楼上萧条海月闲。 借问落梅凡几曲，从风一夜满关山。秦地罗敷女，采桑绿水边。素手青条上，红妆白日鲜。蚕饥妾欲去，五马莫留连。
次北固山下,王湾,客路青山外，行舟绿水前。(青山外 一作：青山下)潮平两岸阔，风正一帆悬。海日生残夜，江春入旧年。乡书何处达？归雁洛阳边。西上太白峰，夕阳穷登攀。太白与我语，为我开天关。愿乘泠风去，直出浮云间。举手可近月，前行若无山。一别武功去，何时复更还？昔闻洞庭水，今上岳阳楼。吴楚东南坼，乾坤日夜浮。亲朋无一字，老病有孤舟。戎马关山北，凭轩涕泗流。吾富有钱时，妇儿看我好。吾若脱衣裳，与吾叠袍袄。吾出经求去，送吾即上道。将钱入舍来，见吾满面笑。绕吾白鸽旋，恰似鹦鹉鸟。邂逅暂时贫，看吾即貌哨。人有七贫时，七富还相报。图财不顾人，且看来时道。
云阳馆与韩绅宿别,司空曙,故人江海别，几度隔山川。乍见翻疑梦，相悲各问年。孤灯寒照雨，深竹暗浮烟。(深竹 一作：湿竹)更有明朝恨，离杯惜共传。桂魄初生秋露微，轻罗已薄未更衣。银筝夜久殷勤弄，心怯空房不忍归。春江潮水连海平，海上明月共潮生。滟滟随波千万里，何处春江无月明！江流宛转绕芳甸，月照花林皆似霰。空里流霜不觉飞，汀上白沙看不见。江天一色无纤尘，皎皎空中孤月轮。江畔何人初见月？江月何年初照人？人生代代无穷已，江月年年望相似。(望相似 一作：只相似)不知江月待何人，但见长江送流水。白云一片去悠悠，青枫浦上不胜愁。谁家今夜扁舟子？何处相思明月楼？可怜楼上月徘徊，应照离人妆镜台。(徘徊 一作：裴回)玉户帘中卷不去，捣衣砧上拂还来。此时相望不相闻，愿逐月华流照君。鸿雁长飞光不度，鱼龙潜跃水成文。昨夜闲潭梦落花，可怜春半不还家。江水流春去欲尽，江潭落月复西斜。斜月沉沉藏海雾，碣石潇湘无限路。不知乘月几人归，落月摇情满江树。(落月 一作：落花)宦情羁思共凄凄，春半如秋意转迷。山城过雨百花尽，榕叶满庭莺乱啼。
喜外弟卢纶见宿,司空曙,静夜四无邻，荒居旧业贫。雨中黄叶树，灯下白头人。以我独沉久，愧君相见频。平生自有分，况是蔡家亲。 八岁偷照镜，长眉已能画。十岁去踏青，芙蓉作裙衩。十二学弹筝，银甲不曾卸。十四藏六亲，悬知犹未嫁。十五泣春风，背面秋千下。去年战，桑干源，今年战，葱河道。洗兵条支海上波，放马天山雪中草。万里长征战，三军尽衰老。匈奴以杀戮为耕作，古来唯见白骨黄沙田。秦家筑城避胡处，汉家还有烽火燃。烽火燃不息，征战无已时。野战格斗死，败马号鸣向天悲。乌鸢啄人肠，衔飞上挂枯树枝。士卒涂草莽，将军空尔为。乃知兵者是凶器，圣人不得已而用之。鸾扇斜分凤幄开，星桥横过鹊飞回。 争将世上无期别，换得年年一度来。
贼平后送人北归,司空曙,世乱同南去，时清独北还。他乡生白发，旧国见青山。 晓月过残垒，繁星宿故关。寒禽与衰草，处处伴愁颜。春江潮水连海平，海上明月共潮生。滟滟随波千万里，何处春江无月明！江流宛转绕芳甸，月照花林皆似霰。空里流霜不觉飞，汀上白沙看不见。江天一色无纤尘，皎皎空中孤月轮。江畔何人初见月？江月何年初照人？人生代代无穷已，江月年年望相似。(望相似 一作：只相似)不知江月待何人，但见长江送流水。白云一片去悠悠，青枫浦上不胜愁。谁家今夜扁舟子？何处相思明月楼？可怜楼上月徘徊，应照离人妆镜台。(徘徊 一作：裴回)玉户帘中卷不去，捣衣砧上拂还来。此时相望不相闻，愿逐月华流照君。鸿雁长飞光不度，鱼龙潜跃水成文。昨夜闲潭梦落花，可怜春半不还家。江水流春去欲尽，江潭落月复西斜。斜月沉沉藏海雾，碣石潇湘无限路。不知乘月几人归，落月摇情满江树。(落月 一作：落花)潮落江平未有风，扁舟共济与君同。时时引领望天末，何处青山是越中。玉颗珊珊下月轮，殿前拾得露华新。 至今不会天中事，应是嫦娥掷与人。
赋得古原草送别,白居易,离离原上草，一岁一枯荣。野火烧不尽，春风吹又生。远芳侵古道，晴翠接荒城。又送王孙去，萋萋满别情。碧玉妆成一树高，万条垂下绿丝绦。不知细叶谁裁出，二月春风似剪刀。小山重叠金明灭，鬓云欲度香腮雪。懒起画蛾眉，弄妆梳洗迟。照花前后镜，花面交相映。新帖绣罗襦，双双金鹧鸪。满宫明月梨花白，故人万里关山隔。金雁一双飞，泪痕沾绣衣。小园芳草绿，家住越溪曲。杨柳色依依，燕归君不归。
题大庾岭北驿,宋之问,阳月南飞雁，传闻至此回。我行殊未已，何日复归来。江静潮初落，林昏瘴不开。明朝望乡处，应见陇头梅。大鹏飞兮振八裔，中天摧兮力不济。馀风激兮万世，游扶桑兮挂左袂。(左袂 一作：石袂)后人得之传此，仲尼亡兮谁为出涕。二月江南花满枝，他乡寒食远堪悲。贫居往往无烟火，不独明朝为子推。庭前芍药妖无格，池上芙蕖净少情。唯有牡丹真国色，花开时节动京城。
寄左省杜拾遗,岑参,联步趋丹陛，分曹限紫微。晓随天仗入，暮惹御香归。白发悲花落，青云羡鸟飞。圣朝无阙事，自觉谏书稀。洛阳访才子，江岭作流人。闻说梅花早，何如北地春。菱叶萦波荷飐风，荷花深处小船通。逢郎欲语低头笑，碧玉搔头落水中。寒山转苍翠，秋水日潺湲。倚杖柴门外，临风听暮蝉。渡头馀落日，墟里上孤烟。(馀 一作 余)复值接舆醉，狂歌五柳前。
听蜀僧浚弹琴,李白,蜀僧抱绿绮，西下峨眉峰。为我一挥手，如听万壑松。 客心洗流水，余响入霜钟。不觉碧山暮，秋云暗几重。曾为流离惯别家，等闲挥袂客天涯。灯前一觉江南梦，惆怅起来山月斜。林暗草惊风，将军夜引弓。平明寻白羽，没在石棱中。闽国扬帆去，蟾蜍亏复团。秋风生渭水，落叶满长安。此地聚会夕，当时雷雨寒。兰桡殊未返，消息海云端。
夜泊牛渚怀古,李白,牛渚西江夜，青天无片云。登舟望秋月，空忆谢将军。余亦能高咏，斯人不可闻。明朝挂帆席，枫叶落纷纷。(席 一作：去)松叶堪为酒，春来酿几多。不辞山路远，踏雪也相过。嫁得瞿塘贾，朝朝误妾期。早知潮有信，嫁与弄潮儿。锦城丝管日纷纷，半入江风半入云。 此曲只应天上有，人间能得几回闻。
赠孟浩然,李白,吾爱孟夫子，风流天下闻。红颜弃轩冕，白首卧松云。 醉月频中圣，迷花不事君。高山安可仰，徒此揖清芬。闲坐悲君亦自悲，百年都是几多时。邓攸无子寻知命，潘岳悼亡犹费词。同穴窅冥何所望，他生缘会更难期。惟将终夜长开眼，报答平生未展眉。团扇，团扇，美人病来遮面。玉颜憔悴三年，谁复商量管弦。弦管，弦管，春草昭阳路断。灞原风雨定，晚见雁行频。落叶他乡树，寒灯独夜人。空园白露滴，孤壁野僧邻。寄卧郊扉久，何年致此身。
渡荆门送别,李白,渡远荆门外，来从楚国游。山随平野尽，江入大荒流。月下飞天镜，云生结海楼。仍怜故乡水，万里送行舟。弓背霞明剑照霜，秋风走马出咸阳。未收天子河湟地，不拟回头望故乡。山围故国周遭在，潮打空城寂寞回。淮水东边旧时月，夜深还过女墙来。美人卷珠帘，深坐蹙蛾眉。(蹙 一作：颦)但见泪痕湿，不知心恨谁。
送友人,李白,青山横北郭，白水绕东城。此地一为别，孤蓬万里征。浮云游子意，落日故人情。挥手自兹去，萧萧班马鸣。岁暮阴阳催短景，天涯霜雪霁寒宵。五更鼓角声悲壮，三峡星河影动摇。野哭千家闻战伐，夷歌数处起渔樵。(千家 一作：几家)卧龙跃马终黄土，人事音书漫寂寥。(音书 一作：依依)春种一粒粟，秋收万颗子。四海无闲田，农夫犹饿死。锄禾日当午，汗滴禾下土。谁知盘中餐，粒粒皆辛苦？千里莺啼绿映红，水村山郭酒旗风。南朝四百八十寺，多少楼台烟雨中。
喜见外弟又言别,李益,十年离乱后，长大一相逢。问姓惊初见，称名忆旧容。别来沧海事，语罢暮天钟。明日巴陵道，秋山又几重。荆溪白石出，天寒红叶稀。山路元无雨，空翠湿人衣。西上莲花山，迢迢见明星。(西上 一作：西岳)素手把芙蓉，虚步蹑太清。霓裳曳广带，飘拂升天行。邀我登云台，高揖卫叔卿。(登云台 一作：至云台)恍恍与之去，驾鸿凌紫冥。俯视洛阳川，茫茫走胡兵。流血涂野草，豺狼尽冠缨。清江一曲柳千条，二十年前旧板桥。曾与美人桥上别，恨无消息到今朝。
凉思,李商隐,客去波平槛，蝉休露满枝。永怀当此节，倚立自移时。 北斗兼春远，南陵寓使迟。天涯占梦数，疑误有新知。庾信文章老更成，凌云健笔意纵横。今人嗤点流传赋，不觉前贤畏后生。王杨卢骆当时体，轻薄为文哂未休。尔曹身与名俱灭，不废江河万古流。纵使卢王操翰墨，劣于汉魏近风骚。龙文虎脊皆君驭，历块过都见尔曹。才力应难夸数公，凡今谁是出群雄。或看翡翠兰苕上，未掣鲸鱼碧海中。不薄今人爱古人，清词丽句必为邻。窃攀屈宋宜方驾，恐与齐梁作后尘。未及前贤更勿疑，递相祖述复先谁。别裁伪体亲风雅，转益多师是汝师。春去也，多谢洛城人。弱柳从风疑举袂，丛兰裛露似沾巾。独坐亦含嚬。春去也，共惜艳阳年。犹有桃花流水上，无辞竹叶醉尊前。惟待见青天。 小娃撑小艇，偷采白莲回。不解藏踪迹，浮萍一道开。
北青萝,李商隐,残阳西入崦，茅屋访孤僧。落叶人何在，寒云路几层。 独敲初夜磬，闲倚一枝藤。世界微尘里，吾宁爱与憎。胡人吹笛戍楼间，楼上萧条海月闲。 借问落梅凡几曲，从风一夜满关山。风动荷花水殿香，姑苏台上宴吴王。西施醉舞娇无力，笑倚东窗白玉床。林卧愁春尽，搴帷览物华。忽逢青鸟使，邀入赤松家。金灶初开火，仙桃正发花。童颜若可驻，何惜醉流霞。
蝉,李商隐,本以高难饱，徒劳恨费声。五更疏欲断，一树碧无情。薄宦梗犹泛，故园芜已平。烦君最相警，我亦举家清。二月湖水清，家家春鸟鸣。林花扫更落，径草踏还生。酒伴来相命，开尊共解酲。当杯已入手，歌妓莫停声。故人西辞黄鹤楼，烟花三月下扬州。孤帆远影碧空尽，唯见长江天际流。 (唯 通：惟)玉露凋伤枫树林，巫山巫峡气萧森。江间波浪兼天涌，塞上风云接地阴。丛菊两开他日泪，孤舟一系故园心。寒衣处处催刀尺，白帝城高急暮砧。
风雨,李商隐,凄凉宝剑篇，羁泊欲穷年。黄叶仍风雨，青楼自管弦。新知遭薄俗，旧好隔良缘。心断新丰酒，销愁斗几千。寒山转苍翠，秋水日潺湲。倚杖柴门外，临风听暮蝉。渡头馀落日，墟里上孤烟。(馀 一作 余)复值接舆醉，狂歌五柳前。宦情羁思共凄凄，春半如秋意转迷。山城过雨百花尽，榕叶满庭莺乱啼。轮台城头夜吹角，轮台城北旄头落。羽书昨夜过渠黎，单于已在金山西。戍楼西望烟尘黑，汉军屯在轮台北。上将拥旄西出征，平明吹笛大军行。四边伐鼓雪海涌，三军大呼阴山动。虏塞兵气连云屯，战场白骨缠草根。剑河风急雪片阔，沙口石冻马蹄脱。(雪片阔 一作：云片阔)亚相勤王甘苦辛，誓将报主静边尘。古来青史谁不见，今见功名胜古人。
落花,李商隐,高阁客竟去，小园花乱飞。参差连曲陌，迢递送斜晖。肠断未忍扫，眼穿仍欲归。芳心向春尽，所得是沾衣。闺中少妇不知愁，春日凝妆上翠楼。(不知 一作：不曾)忽见陌头杨柳色，悔教夫婿觅封侯。冀马燕犀动地来，自埋红粉自成灰。君王若道能倾国，玉辇何由过马嵬。海外徒闻更九州，他生未卜此生休。空闻虎旅传宵柝，无复鸡人报晓筹。此日六军同驻马，当时七夕笑牵牛。如何四纪为天子，不及卢家有莫愁。西上太白峰，夕阳穷登攀。太白与我语，为我开天关。愿乘泠风去，直出浮云间。举手可近月，前行若无山。一别武功去，何时复更还？
登岳阳楼,杜甫,昔闻洞庭水，今上岳阳楼。吴楚东南坼，乾坤日夜浮。亲朋无一字，老病有孤舟。戎马关山北，凭轩涕泗流。支离东北风尘际，漂泊西南天地间。三峡楼台淹日月，五溪衣服共云山。羯胡事主终无赖，词客哀时且未还。庾信平生最萧瑟，暮年诗赋动江关。几度见诗诗总好，及观标格过于诗。平生不解藏人善，到处逢人说项斯。越王勾践破吴归，义士还家尽锦衣。(义士 一作：战士)宫女如花满春殿，只今惟有鹧鸪飞。
