poem_name,author,poem_content
感遇·兰叶春葳蕤,张九龄,兰叶春葳蕤，桂华秋皎洁。欣欣此生意，自尔为佳节。谁知林栖者，闻风坐相悦。草木有本心，何求美人折！滕王高阁临江渚，佩玉鸣鸾罢歌舞。画栋朝飞南浦云，珠帘暮卷西山雨。闲云潭影日悠悠，物换星移几度秋。阁中帝子今何在？槛外长江空自流。迢递三巴路，羁危万里身。乱山残雪夜，孤烛异乡人。(异乡人 一作：异乡春)渐与骨肉远，转于僮仆亲。那堪正飘泊，明日岁华新。越王勾践破吴归，义士还家尽锦衣。(义士 一作：战士)宫女如花满春殿，只今惟有鹧鸪飞。
感遇·幽人归独卧,张九龄,幽人归独卧，滞虑洗孤清。持此谢高鸟，因之传远情。日夕怀空意，人谁感至精？飞沉理自隔，何所慰吾诚？沅湘流不尽，屈子怨何深。日暮秋风起，萧萧枫树林。本以高难饱，徒劳恨费声。五更疏欲断，一树碧无情。薄宦梗犹泛，故园芜已平。烦君最相警，我亦举家清。已讶衾枕冷，复见窗户明。夜深知雪重，时闻折竹声。
感遇·江南有丹橘,张九龄,江南有丹橘，经冬犹绿林。岂伊地气暖？自有岁寒心。可以荐嘉客，奈何阻重深。运命唯所遇，循环不可寻。徒言树桃李，此木岂无阴？群鸡正乱叫，客至鸡斗争。驱鸡上树木，始闻叩柴荆。父老四五人，问我久远行。手中各有携，倾榼浊复清。苦辞酒味薄，黍地无人耕。(苦 一作：莫)兵戈既未息，儿童尽东征。请为父老歌：艰难愧深情！歌罢仰天叹，四座泪纵横。九日龙山饮，黄花笑逐臣。醉看风落帽，舞爱月留人。秦中花鸟已应阑，塞外风沙犹自寒。夜听胡笳折杨柳，教人意气忆长安。
春泛若耶溪,綦毋潜,幽意无断绝，此去随所偶。晚风吹行舟，花路入溪口。际夜转西壑，隔山望南斗。潭烟飞溶溶，林月低向后。生事且弥漫，愿为持竿叟。孔明庙前有老柏，柯如青铜根如石。霜皮溜雨四十围，黛色参天二千尺。君臣已与时际会，树木犹为人爱惜。云来气接巫峡长，月出寒通雪山白。忆昨路绕锦亭东，先主武侯同閟宫。崔嵬枝干郊原古，窈窕丹青户牖空。落落盘踞虽得地，冥冥孤高多烈风。扶持自是神明力，正直原因造化工。大厦如倾要梁栋，万牛回首丘山重。不露文章世已惊，未辞翦伐谁能送？苦心岂免容蝼蚁，香叶终经宿鸾凤。志士幽人莫怨嗟：古来材大难为用。寂寂竟何待，朝朝空自归。欲寻芳草去，惜与故人违。当路谁相假，知音世所稀。只应守寂寞，还掩故园扉。　　自余为僇人，居是州，恒惴栗。其隙也，则施施而行，漫漫而游。日与其徒上高山，入深林，穷回溪，幽泉怪石，无远不到。到则披草而坐，倾壶而醉。醉则更相枕以卧，卧而梦。意有所极，梦亦同趣。觉而起，起而归；以为凡是州之山水有异态者，皆我有也，而未始知西山之怪特。　　今年九月二十八日，因坐法华西亭，望西山，始指异之。遂命仆人过湘江，缘染溪，斫榛莽，焚茅茷，穷山之高而止。攀援而登，箕踞而遨，则凡数州之土壤，皆在衽席之下。其高下之势，岈然洼然，若垤若穴，尺寸千里，攒蹙累积，莫得遁隐。萦青缭白，外与天际，四望如一。然后知是山之特立，不与培塿为类。悠悠乎与颢气俱，而莫得其涯；洋洋乎与造物者游，而不知其所穷。引觞满酌，颓然就醉，不知日之入。苍然暮色，自远而至，至无所见，而犹不欲归。心凝形释，与万化冥合。然后知吾向之未始游，游于是乎始。故为之文以志。是岁，元和四年也。
石鱼湖上醉歌,元结,漫叟以公田米酿酒，因休暇，则载酒于湖上，时取一醉。欢醉中，据湖岸，引臂向鱼取酒，使舫载之，遍饮坐者。意疑倚巴丘酌于君山之上，诸子环洞庭而坐，酒舫泛泛然触波涛。而往来者，乃作歌以长之。石鱼湖，似洞庭，夏水欲满君山青。山为樽，水为沼，酒徒历历坐洲岛。长风连日作大浪，不能废人运酒舫。我持长瓢坐巴丘，酌饮四坐以散愁。洞庭西望楚江分，水尽南天不见云。日落长沙秋色远，不知何处吊湘君。南湖秋水夜无烟，耐可乘流直上天。且就洞庭赊月色，将船买酒白云边。洛阳才子谪湘川，元礼同舟月下仙。记得长安还欲笑，不知何处是西天。洞庭湖西秋月辉，潇湘江北早鸿飞。醉客满船歌白苎，不知霜露入秋衣。帝子潇湘去不还，空馀秋草洞庭间。淡扫明湖开玉镜，丹青画出是君山。　　黔无驴，有好事者船载以入。至则无可用，放之山下。虎见之，庞然大物也，以为神，蔽林间窥之。稍出近之，慭慭然，莫相知。　　他日，驴一鸣，虎大骇，远遁；以为且噬己也，甚恐。然往来视之，觉无异能者；益习其声，又近出前后，终不敢搏。稍近，益狎，荡倚冲冒。驴不胜怒，蹄之。虎因喜，计之曰：“技止此耳！”因跳踉大㘎，断其喉，尽其肉，乃去。　　噫！形之庞也类有德，声之宏也类有能。向不出其技，虎虽猛，疑畏，卒不敢取。今若是焉，悲夫！击筑饮美酒，剑歌易水湄。经过燕太子，结托并州儿。少年负壮气，奋烈自有时。因击鲁句践，争博勿相欺。五陵年少金市东，银鞍白马度春风。落花踏尽游何处，笑入胡姬酒肆中。
长恨歌,白居易,汉皇重色思倾国，御宇多年求不得。杨家有女初长成，养在深闺人未识。天生丽质难自弃，一朝选在君王侧。回眸一笑百媚生，六宫粉黛无颜色。春寒赐浴华清池，温泉水滑洗凝脂。侍儿扶起娇无力，始是新承恩泽时。云鬓花颜金步摇，芙蓉帐暖度春宵。春宵苦短日高起，从此君王不早朝。承欢侍宴无闲暇，春从春游夜专夜。后宫佳丽三千人，三千宠爱在一身。金屋妆成娇侍夜，玉楼宴罢醉和春。姊妹弟兄皆列土，可怜光彩生门户。遂令天下父母心，不重生男重生女。骊宫高处入青云，仙乐风飘处处闻。缓歌慢舞凝丝竹，尽日君王看不足。渔阳鼙鼓动地来，惊破《霓裳羽衣曲》。九重城阙烟尘生，千乘万骑西南行。翠华摇摇行复止，西出都门百余里。六军不发无奈何，宛转蛾眉马前死。花钿委地无人收，翠翘金雀玉搔头。君王掩面救不得，回看血泪相和流。黄埃散漫风萧索，云栈萦纡登剑阁。峨嵋山下少人行，旌旗无光日色薄。蜀江水碧蜀山青，圣主朝朝暮暮情。行宫见月伤心色，夜雨闻铃肠断声。天旋日转回龙驭，到此踌躇不能去。(日转 一作：地转)马嵬坡下泥土中，不见玉颜空死处。君臣相顾尽沾衣，东望都门信马归。归来池苑皆依旧，太液芙蓉未央柳。芙蓉如面柳如眉，对此如何不泪垂？春风桃李花开夜，秋雨梧桐叶落时。(花开夜 一作：花开日)西宫南内多秋草，落叶满阶红不扫。(南内 一作：南苑)梨园弟子白发新，椒房阿监青娥老。夕殿萤飞思悄然，孤灯挑尽未成眠。迟迟钟鼓初长夜，耿耿星河欲曙天。鸳鸯瓦冷霜华重，翡翠衾寒谁与共？悠悠生死别经年，魂魄不曾来入梦。临邛道士鸿都客，能以精诚致魂魄。为感君王辗转思，遂教方士殷勤觅。排空驭气奔如电，升天入地求之遍。上穷碧落下黄泉，两处茫茫皆不见。忽闻海上有仙山，山在虚无缥缈间。楼阁玲珑五云起，其中绰约多仙子。中有一人字太真，雪肤花貌参差是。金阙西厢叩玉扃，转教小玉报双成。闻道汉家天子使，九华帐里梦魂惊。揽衣推枕起徘徊，珠箔银屏迤逦开。云鬓半偏新睡觉，花冠不整下堂来。风吹仙袂飘飖举，犹似霓裳羽衣舞。(飘飖 一作：飘飘)玉容寂寞泪阑干，梨花一枝春带雨。(阑 通：栏)含情凝睇谢君王，一别音容两渺茫。昭阳殿里恩爱绝，蓬莱宫中日月长。回头下望人寰处，不见长安见尘雾。惟将旧物表深情，钿合金钗寄将去。钗留一股合一扇，钗擘黄金合分钿。但令心似金钿坚，天上人间会相见。(但令 一作：但教)临别殷勤重寄词，词中有誓两心知。七月七日长生殿，夜半无人私语时。在天愿作比翼鸟，在地愿为连理枝。天长地久有时尽，此恨绵绵无绝期。秦时明月汉时关，万里长征人未还。但使龙城飞将在，不教胡马度阴山。骝马新跨白玉鞍，战罢沙场月色寒。城头铁鼓声犹震，匣里金刀血未干。船下广陵去，月明征虏亭。山花如绣颊，江火似流萤。小山重叠金明灭，鬓云欲度香腮雪。懒起画蛾眉，弄妆梳洗迟。照花前后镜，花面交相映。新帖绣罗襦，双双金鹧鸪。
琵琶行,白居易,元和十年，予左迁九江郡司马。明年秋，送客湓浦口，闻舟中夜弹琵琶者，听其音，铮铮然有京都声。问其人，本长安倡女，尝学琵琶于穆、曹二善才，年长色衰，委身为贾人妇。遂命酒，使快弹数曲。曲罢悯然，自叙少小时欢乐事，今漂沦憔悴，转徙于江湖间。予出官二年，恬然自安，感斯人言，是夕始觉有迁谪意。因为长句，歌以赠之，凡六百一十六言，命曰《琵琶行》。浔阳江头夜送客，枫叶荻花秋瑟瑟。主人下马客在船，举酒欲饮无管弦。醉不成欢惨将别，别时茫茫江浸月。忽闻水上琵琶声，主人忘归客不发。寻声暗问弹者谁，琵琶声停欲语迟。移船相近邀相见，添酒回灯重开宴。千呼万唤始出来，犹抱琵琶半遮面。转轴拨弦三两声，未成曲调先有情。弦弦掩抑声声思，似诉平生不得志。低眉信手续续弹，说尽心中无限事。轻拢慢捻抹复挑，初为《霓裳》后《六幺》。(六幺 一作：绿腰)大弦嘈嘈如急雨，小弦切切如私语。嘈嘈切切错杂弹，大珠小珠落玉盘。间关莺语花底滑，幽咽泉流冰下难。冰泉冷涩弦凝绝，凝绝不通声暂歇。(暂歇 一作：渐歇)别有幽愁暗恨生，此时无声胜有声。银瓶乍破水浆迸，铁骑突出刀枪鸣。曲终收拨当心画，四弦一声如裂帛。东船西舫悄无言，唯见江心秋月白。沉吟放拨插弦中，整顿衣裳起敛容。自言本是京城女，家在虾蟆陵下住。十三学得琵琶成，名属教坊第一部。曲罢曾教善才服，妆成每被秋娘妒。(服 一作：伏)五陵年少争缠头，一曲红绡不知数。钿头银篦击节碎，血色罗裙翻酒污。(银篦 一作：云篦)今年欢笑复明年，秋月春风等闲度。弟走从军阿姨死，暮去朝来颜色故。门前冷落鞍马稀，老大嫁作商人妇。商人重利轻别离，前月浮梁买茶去。去来江口守空船，绕船月明江水寒。夜深忽梦少年事，梦啼妆泪红阑干。我闻琵琶已叹息，又闻此语重唧唧。同是天涯沦落人，相逢何必曾相识！我从去年辞帝京，谪居卧病浔阳城。浔阳地僻无音乐，终岁不闻丝竹声。住近湓江地低湿，黄芦苦竹绕宅生。其间旦暮闻何物？杜鹃啼血猿哀鸣。春江花朝秋月夜，往往取酒还独倾。岂无山歌与村笛，呕哑嘲哳难为听。今夜闻君琵琶语，如听仙乐耳暂明。莫辞更坐弹一曲，为君翻作《琵琶行》。感我此言良久立，却坐促弦弦转急。凄凄不似向前声，满座重闻皆掩泣。座中泣下谁最多？江州司马青衫湿。天山雪后海风寒，横笛偏吹行路难。碛里征人三十万，一时回首月中看。绿塘摇滟接星津，轧轧兰桡入白蘋。应为洛神波上袜，至今莲蕊有香尘。击石乃有火，不击元无烟。人学始知道，不学非自然。万事须己运，他得非我贤。青春须早为，岂能长少年。
走马川行奉送封大夫出师,岑参,君不见走马川行雪海边，平沙莽莽黄入天。 轮台九月风夜吼，一川碎石大如斗，随风满地石乱走。 匈奴草黄马正肥，金山西见烟尘飞，汉家大将西出师。 将军金甲夜不脱，半夜军行戈相拨，风头如刀面如割。 马毛带雪汗气蒸，五花连钱旋作冰，幕中草檄砚水凝。 虏骑闻之应胆慑，料知短兵不敢接，车师西门伫献捷。(车师 一作：军师)静夜四无邻，荒居旧业贫。雨中黄叶树，灯下白头人。以我独沉久，愧君相见频。平生自有分，况是蔡家亲。 独有宦游人，偏惊物候新。云霞出海曙，梅柳渡江春。淑气催黄鸟，晴光转绿蘋。忽闻歌古调，归思欲沾巾。鹅湖山下稻粱肥，豚栅鸡栖半掩扉。 桑柘影斜春社散，家家扶得醉人归。
轮台歌奉送封大夫出师,岑参,轮台城头夜吹角，轮台城北旄头落。羽书昨夜过渠黎，单于已在金山西。戍楼西望烟尘黑，汉军屯在轮台北。上将拥旄西出征，平明吹笛大军行。四边伐鼓雪海涌，三军大呼阴山动。虏塞兵气连云屯，战场白骨缠草根。剑河风急雪片阔，沙口石冻马蹄脱。(雪片阔 一作：云片阔)亚相勤王甘苦辛，誓将报主静边尘。古来青史谁不见，今见功名胜古人。春日游，杏花吹满头。陌上谁家年少，足风流。妾拟将身嫁与，一生休。纵被无情弃，不能羞。静夜四无邻，荒居旧业贫。雨中黄叶树，灯下白头人。以我独沉久，愧君相见频。平生自有分，况是蔡家亲。 孔明庙前有老柏，柯如青铜根如石。霜皮溜雨四十围，黛色参天二千尺。君臣已与时际会，树木犹为人爱惜。云来气接巫峡长，月出寒通雪山白。忆昨路绕锦亭东，先主武侯同閟宫。崔嵬枝干郊原古，窈窕丹青户牖空。落落盘踞虽得地，冥冥孤高多烈风。扶持自是神明力，正直原因造化工。大厦如倾要梁栋，万牛回首丘山重。不露文章世已惊，未辞翦伐谁能送？苦心岂免容蝼蚁，香叶终经宿鸾凤。志士幽人莫怨嗟：古来材大难为用。
白雪歌送武判官归京,岑参,北风卷地白草折，胡天八月即飞雪。忽如一夜春风来，千树万树梨花开。散入珠帘湿罗幕，狐裘不暖锦衾薄。将军角弓不得控，都护铁衣冷难着。(难着 一作：犹著)瀚海阑干百丈冰，愁云惨淡万里凝。中军置酒饮归客，胡琴琵琶与羌笛。纷纷暮雪下辕门，风掣红旗冻不翻。轮台东门送君去，去时雪满天山路。山回路转不见君，雪上空留马行处。清瑟怨遥夜，绕弦风雨哀。孤灯闻楚角，残月下章台。芳草已云暮，故人殊未来。乡书不可寄，秋雁又南回。细草微风岸，危樯独夜舟。星垂平野阔，月涌大江流。名岂文章著，官应老病休。飘飘何所似，天地一沙鸥。庾信文章老更成，凌云健笔意纵横。今人嗤点流传赋，不觉前贤畏后生。王杨卢骆当时体，轻薄为文哂未休。尔曹身与名俱灭，不废江河万古流。纵使卢王操翰墨，劣于汉魏近风骚。龙文虎脊皆君驭，历块过都见尔曹。才力应难夸数公，凡今谁是出群雄。或看翡翠兰苕上，未掣鲸鱼碧海中。不薄今人爱古人，清词丽句必为邻。窃攀屈宋宜方驾，恐与齐梁作后尘。未及前贤更勿疑，递相祖述复先谁。别裁伪体亲风雅，转益多师是汝师。
宣州谢脁楼饯别校书叔云,李白,弃我去者，昨日之日不可留；乱我心者，今日之日多烦忧。长风万里送秋雁，对此可以酣高楼。蓬莱文章建安骨，中间小谢又清发。俱怀逸兴壮思飞，欲上青天揽明月。(揽 一作：览；明月 一作：日月)抽刀断水水更流，举杯销愁愁更愁。(销愁 一作：消愁)人生在世不称意，明朝散发弄扁舟。锦城丝管日纷纷，半入江风半入云。 此曲只应天上有，人间能得几回闻。曾伴浮云归晚翠，犹陪落日泛秋声。世间无限丹青手，一片伤心画不成。清川带长薄，车马去闲闲。流水如有意，暮禽相与还。荒城临古渡，落日满秋山。迢递嵩高下，归来且闭关。
庐山谣寄卢侍御虚舟,李白,我本楚狂人，凤歌笑孔丘。手持绿玉杖，朝别黄鹤楼。五岳寻仙不辞远，一生好入名山游。庐山秀出南斗傍，屏风九叠云锦张，影落明湖青黛光。金阙前开二峰长，银河倒挂三石梁，香炉瀑布遥相望，回崖沓嶂凌苍苍。翠影红霞映朝日，鸟飞不到吴天长。登高壮观天地间，大江茫茫去不还。黄云万里动风色，白波九道流雪山。好为庐山谣，兴因庐山发。闲窥石镜清我心，谢公行处苍苔没。早服还丹无世情，琴心三叠道初成。遥见仙人彩云里，手把芙蓉朝玉京。先期汗漫九垓上，愿接卢敖游太清。明月出天山，苍茫云海间。长风几万里，吹度玉门关。汉下白登道，胡窥青海湾。由来征战地，不见有人还。戍客望边邑，思归多苦颜。(望边邑 一作：望边色)高楼当此夜，叹息未应闲。何事居穷道不穷，乱时还与静时同。家山虽在干戈地，弟侄常修礼乐风。窗竹影摇书案上，野泉声入砚池中。少年辛苦终身事，莫向光阴惰寸功。沅湘流不尽，屈子怨何深。日暮秋风起，萧萧枫树林。
梦游天姥吟留别,李白,海客谈瀛洲，烟涛微茫信难求；越人语天姥，云霞明灭或可睹。天姥连天向天横，势拔五岳掩赤城。天台四万八千丈，对此欲倒东南倾。我欲因之梦吴越，一夜飞度镜湖月。湖月照我影，送我至剡溪。谢公宿处今尚在，渌水荡漾清猿啼。脚著谢公屐，身登青云梯。半壁见海日，空中闻天鸡。千岩万转路不定，迷花倚石忽已暝。熊咆龙吟殷岩泉，栗深林兮惊层巅。云青青兮欲雨，水澹澹兮生烟。列缺霹雳，丘峦崩摧。洞天石扉，訇然中开。青冥浩荡不见底，日月照耀金银台。 霓为衣兮风为马，云之君兮纷纷而来下。虎鼓瑟兮鸾回车，仙之人兮列如麻。忽魂悸以魄动，恍惊起而长嗟。惟觉时之枕席，失向来之烟霞。世间行乐亦如此，古来万事东流水。别君去兮何时还？且放白鹿青崖间，须行即骑访名山。安能摧眉折腰事权贵，使我不得开心颜？银烛秋光冷画屏，轻罗小扇扑流萤。天阶夜色凉如水，卧看牵牛织女星。(天阶 一作：天街；卧看 一作：坐看)家住孟津河，门对孟津口。常有江南船，寄书家中否。君自故乡来，应知故乡事。来日绮窗前，寒梅著花未。已见寒梅发，复闻啼鸟声。心心视春草，畏向阶前生。兔丝附蓬麻，引蔓故不长。嫁女与征夫，不如弃路旁。结发为君妻，席不暖君床。暮婚晨告别，无乃太匆忙。君行虽不远，守边赴河阳。妾身未分明，何以拜姑嫜？父母养我时，日夜令我藏。生女有所归，鸡狗亦得将。君今往死地，沉痛迫中肠。誓欲随君去，形势反苍黄。勿为新婚念，努力事戎行。妇人在军中，兵气恐不扬。自嗟贫家女，久致罗襦裳。罗襦不复施，对君洗红妆。仰视百鸟飞，大小必双翔。人事多错迕，与君永相望。
金陵酒肆留别,李白,风吹柳花满店香，吴姬压酒劝客尝。(劝客 一作：唤客)金陵子弟来相送，欲行不行各尽觞。请君试问东流水，别意与之谁短长？闲坐夜明月，幽人弹素琴。忽闻悲风调，宛若寒松吟。 白雪乱纤手，绿水清虚心。钟期久已没，世上无知音。春去也，多谢洛城人。弱柳从风疑举袂，丛兰裛露似沾巾。独坐亦含嚬。春去也，共惜艳阳年。犹有桃花流水上，无辞竹叶醉尊前。惟待见青天。 有美一人兮，婉如青扬。识曲别音兮，令姿煌煌。 绣袂捧琴兮，登君子堂。如彼萱草兮，使我忧忘。 欲赠之以紫玉尺，白银铛。久不见之兮，湘水茫茫。
韩碑,李商隐,元和天子神武姿，彼何人哉轩与羲。誓将上雪列圣耻，坐法宫中朝四夷。淮西有贼五十载，封狼生貙貙生罴。不据山河据平地，长戈利矛日可麾。帝得圣相相曰度，贼斫不死神扶持。腰悬相印作都统，阴风惨澹天王旗。愬武古通作牙爪，仪曹外郎载笔随。 行军司马智且勇，十四万众犹虎貔。入蔡缚贼献太庙，功无与让恩不訾。帝曰汝度功第一，汝从事愈宜为辞。愈拜稽首蹈且舞，金石刻画臣能为。古者世称大手笔，此事不系于职司。当仁自古有不让，言讫屡颔天子颐。公退斋戒坐小阁，濡染大笔何淋漓。点窜《尧典》《舜典》字，涂改《清庙》《生民》诗。文成破体书在纸，清晨再拜铺丹墀。表曰臣愈昧死上，咏神圣功书之碑。碑高三丈字如斗，负以灵鳌蟠以螭。句奇语重喻者少，谗之天子言其私。长绳百尺拽碑倒，粗砂大石相磨治。公之斯文若元气，先时已入人肝脾。汤盘孔鼎有述作，今无其器存其辞。呜呼圣王及圣相，相与烜赫流淳熙。公之斯文不示后，曷与三五相攀追。愿书万本诵万遍，口角流沫右手胝。传之七十有二代，以为封禅玉检明堂基。岁岁金河复玉关，朝朝马策与刀环。 三春白雪归青冢，万里黄河绕黑山。云想衣裳花想容，春风拂槛露华浓。 若非群玉山头见，会向瑶台月下逢。百感中来不自由，角声孤起夕阳楼。(中 一作：衷)碧山终日思无尽，芳草何年恨即休？睫在眼前长不见，道非身外更何求。谁人得似张公子，千首诗轻万户侯。
听董大弹胡笳声兼寄语,李颀,蔡女昔造胡笳声，一弹一十有八拍。胡人落泪沾边草，汉使断肠对归客。古戍苍苍烽火寒，大荒沉沉飞雪白。先拂商弦后角羽，四郊秋叶惊摵摵。董夫子，通神明，深山窃听来妖精。言迟更速皆应手，将往复旋如有情。空山百鸟散还合，万里浮云阴且晴。嘶酸雏雁失群夜，断绝胡儿恋母声。川为静其波，鸟亦罢其鸣。乌孙部落家乡远，逻娑沙尘哀怨生。幽音变调忽飘洒，长风吹林雨堕瓦。迸泉飒飒飞木末，野鹿呦呦走堂下。长安城连东掖垣，凤凰池对青琐门。高才脱略名与利，日夕望君抱琴至。素蘤多蒙别艳欺，此花端合在瑶池。(端合 一作：真合)无情有恨何人觉？月晓风清欲堕时。东来万里客，乱定几年归？肠断江城雁，高高向北飞。胜败兵家事不期，包羞忍耻是男儿。 江东子弟多才俊，卷土重来未可知。
听安万善吹觱篥歌,李颀,南山截竹为觱篥，此乐本自龟兹出。流传汉地曲转奇，凉州胡人为我吹。傍邻闻者多叹息，远客思乡皆泪垂。世人解听不解赏，长飙风中自来往。枯桑老柏寒飕飗，九雏鸣凤乱啾啾。龙吟虎啸一时发，万籁百泉相与秋。忽然更作渔阳掺，黄云萧条白日暗。变调如闻杨柳春，上林繁花照眼新。岁夜高堂列明烛，美酒一杯声一曲。越王勾践破吴归，义士还家尽锦衣。(义士 一作：战士)宫女如花满春殿，只今惟有鹧鸪飞。　　蝜蝂者，善负小虫也。行遇物，辄持取，卬其首负之。背愈重，虽困剧不止也。其背甚涩，物积因不散，卒踬仆不能起。人或怜之，为去其负。苟能行，又持取如故。又好上高，极其力不已，至坠地死。　　今世之嗜取者，遇货不避，以厚其室，不知为己累也，唯恐其不积。及其怠而踬也，黜弃之，迁徙之，亦以病矣。苟能起，又不艾。日思高其位，大其禄，而贪取滋甚，以近于危坠，观前之死亡，不知戒。虽其形魁然大者也，其名人也，而智则小虫也。亦足哀夫！绿蚁新醅酒，红泥小火炉。晚来天欲雪，能饮一杯无？
古意,李颀,男儿事长征，少小幽燕客。赌胜马蹄下，由来轻七尺。杀人莫敢前，须如猬毛磔。黄云陇底白云飞，未得报恩不得归。辽东小妇年十五，惯弹琵琶解歌舞。今为羌笛出塞声，使我三军泪如雨。卢家少妇郁金堂，海燕双栖玳瑁梁。九月寒砧催木叶，十年征戍忆辽阳。白狼河北音书断，丹凤城南秋夜长。谁谓含愁独不见，更教明月照流黄。寒山转苍翠，秋水日潺湲。倚杖柴门外，临风听暮蝉。渡头馀落日，墟里上孤烟。(馀 一作 余)复值接舆醉，狂歌五柳前。夜来携手梦同游，晨起盈巾泪莫收。漳浦老身三度病，咸阳宿草八回秋。君埋泉下泥销骨，我寄人间雪满头。阿卫韩郎相次去，夜台茫昧得知不？
