poem_name,author,poem_content
遣悲怀三首·其一,元稹,谢公最小偏怜女，自嫁黔娄百事乖。顾我无衣搜荩箧，泥他沽酒拔金钗。(荩箧 一作：画箧)野蔬充膳甘长藿，落叶添薪仰古槐。今日俸钱过十万，与君营奠复营斋。吴姬越艳楚王妃，争弄莲舟水湿衣。来时浦口花迎入，采罢江头月送归。荷叶罗裙一色裁，芙蓉向脸两边开。乱入池中看不见，闻歌始觉有人来。瑶池阿母绮窗开，黄竹歌声动地哀。 八骏日行三万里，穆王何事不重来。落日欲没岘山西，倒著接蓠花下迷。襄阳小儿齐拍手，拦街争唱《白铜鞮》。旁人借问笑何事，笑杀山公醉似泥。鸬鹚杓，鹦鹉杯。百年三万六千日， 一日须倾三百杯。遥看汉水鸭头绿，恰似葡萄初酦醅。此江若变作春酒，垒曲便筑糟丘台。千金骏马换小妾，醉坐雕鞍歌《落梅》。车旁侧挂一壶酒，凤笙龙管行相催。咸阳市中叹黄犬，何如月下倾金罍？君不见晋朝羊公一片石，龟头剥落生莓苔。泪亦不能为之堕，心亦不能为之哀。清风朗月不用一钱买，玉山自倒非人推。舒州杓，力士铛，李白与尔同死生。襄王云雨今安在？江水东流猿夜声。
遣悲怀三首·其二,元稹,昔日戏言身后意，今朝都到眼前来。(身后意 一作：身后事)衣裳已施行看尽，针线犹存未忍开。尚想旧情怜婢仆，也曾因梦送钱财。诚知此恨人人有，贫贱夫妻百事哀。一双幽色出凡尘，数粒秋烟二尺鳞。 从此静窗闻细韵，琴声长伴读书人。定定住天涯，依依向物华。寒梅最堪恨，常作去年花。宣室求贤访逐臣，贾生才调更无伦。可怜夜半虚前席，不问苍生问鬼神。
遣悲怀三首·其三,元稹,闲坐悲君亦自悲，百年都是几多时。邓攸无子寻知命，潘岳悼亡犹费词。同穴窅冥何所望，他生缘会更难期。惟将终夜长开眼，报答平生未展眉。荷叶罗裙一色裁，芙蓉向脸两边开。乱入池中看不见，闻歌始觉有人来。寒山转苍翠，秋水日潺湲。倚杖柴门外，临风听暮蝉。渡头馀落日，墟里上孤烟。(馀 一作 余)复值接舆醉，狂歌五柳前。北斗七星高，哥舒夜带刀。至今窥牧马，不敢过临洮。
赠郭给事,王维,洞门高阁霭馀辉，桃李阴阴柳絮飞。禁里疏钟官舍晚，省中啼鸟吏人稀。晨摇玉佩趋金殿，夕奉天书拜琐闱。强欲从君无那老，将因卧病解朝衣。昨夜斗回北，今朝岁起东。我年已强仕，无禄尚忧农。桑野就耕父，荷锄随牧童。田家占气候，共说此年丰。吟君叹逝双绝句，使我伤怀奏短歌。世上空惊故人少，集中惟觉祭文多。芳林新叶催陈叶，流水前波让后波。万古到今同此恨，闻琴泪尽欲如何。上马带吴钩，翩翩度陇头。小来思报国，不是爱封侯。万里乡为梦，三边月作愁。早须清黠虏，无事莫经秋。
和贾至舍人早朝大明宫,王维,绛帻鸡人报晓筹，尚衣方进翠云裘。九天阊阖开宫殿，万国衣冠拜冕旒。日色才临仙掌动，香烟欲傍衮龙浮。朝罢须裁五色诏，佩声归到凤池头。画堂晨起，来报雪花坠。高卷帘栊看佳瑞，皓色远迷庭砌。盛气光引炉烟，素草寒生玉佩。应是天仙狂醉，乱把白云揉碎。游人五陵去，宝剑值千金。分手脱相赠，平生一片心。远信入门先有泪，妻惊女哭问何如。寻常不省曾如此，应是江州司马书。
奉和圣制从蓬莱向兴庆阁道,王维,渭水自萦秦塞曲，黄山旧绕汉宫斜。銮舆迥出千门柳，阁道回看上苑花。云里帝城双凤阙，雨中春树万人家。为乘阳气行时令，不是宸游玩物华。(玩 一作：重)谁谓伤心画不成，画人心逐世人情。 君看六幅南朝事，老木寒云满故城。桐风惊心壮士苦，衰灯络纬啼寒素。谁看青简一编书，不遣花虫粉空蠹。思牵今夜肠应直，雨冷香魂吊书客。秋坟鬼唱鲍家诗，恨血千年土中碧。回望高城落晓河，长亭窗户压微波。水仙欲上鲤鱼去，一夜芙蓉红泪多。
积雨辋川庄作,王维,积雨空林烟火迟，蒸藜炊黍饷东菑。漠漠水田飞白鹭，阴阴夏木啭黄鹂。山中习静观朝槿，松下清斋折露葵。野老与人争席罢，海鸥何事更相疑。寒更传晓箭，清镜览衰颜。隔牖风惊竹，开门雪满山。洒空深巷静，积素广庭闲。借问袁安舍，翛然尚闭关。天覆吾，地载吾，天地生吾有意无。不然绝粒升天衢，不然鸣珂游帝都。焉能不贵复不去，空作昂藏一丈夫。一丈夫兮一丈夫，千生气志是良图。请君看取百年事，业就扁舟泛五湖。闲坐夜明月，幽人弹素琴。忽闻悲风调，宛若寒松吟。 白雪乱纤手，绿水清虚心。钟期久已没，世上无知音。
望月有感,白居易,自河南经乱，关内阻饥，兄弟离散，各在一处。因望月有感，聊书所怀，寄上浮梁大兄、於潜七兄、乌江十五兄，兼示符离及下邽弟妹。时难年荒世业空，弟兄羁旅各西东。田园寥落干戈后，骨肉流离道路中。吊影分为千里雁，辞根散作九秋蓬。共看明月应垂泪，一夜乡心五处同。明朝驿使发，一夜絮征袍。素手抽针冷，那堪把剪刀。裁缝寄远道，几日到临洮。红叶晚萧萧，长亭酒一瓢。残云归太华，疏雨过中条。树色随山迥，河声入海遥。帝乡明日到，犹自梦渔樵。六出飞花入户时，坐看青竹变琼枝。如今好上高楼望，盖尽人间恶路岐。
奉和中书舍人贾至早朝,岑参,鸡鸣紫陌曙光寒，莺啭皇州春色阑。金阙晓钟开万户，玉阶仙仗拥千官。花迎剑佩星初落，柳拂旌旗露未干。独有凤凰池上客，阳春一曲和皆难。茂陵多病后，尚爱卓文君。酒肆人间世，琴台日暮云。野花留宝靥，蔓草见罗裙。归凤求凰意，寥寥不复闻。闽国扬帆去，蟾蜍亏复团。秋风生渭水，落叶满长安。此地聚会夕，当时雷雨寒。兰桡殊未返，消息海云端。太乙近天都，连山接海隅。(接 一作：到)白云回望合，青霭入看无。分野中峰变，阴晴众壑殊。欲投人处宿，隔水问樵夫。
登金陵凤凰台,李白,凤凰台上凤凰游，凤去台空江自流。吴宫花草埋幽径，晋代衣冠成古丘。三山半落青天外，二水中分白鹭洲。(二水 一作：一水)总为浮云能蔽日，长安不见使人愁。玉露凋伤枫树林，巫山巫峡气萧森。江间波浪兼天涌，塞上风云接地阴。丛菊两开他日泪，孤舟一系故园心。寒衣处处催刀尺，白帝城高急暮砧。客行新安道，喧呼闻点兵。借问新安吏：“县小更无丁？”“府帖昨夜下，次选中男行。”“中男绝短小，何以守王城？”肥男有母送，瘦男独伶俜。白水暮东流，青山犹哭声。“莫自使眼枯，收汝泪纵横。眼枯即见骨，天地终无情！我军取相州，日夕望其平。岂意贼难料，归军星散营。就粮近故垒，练卒依旧京。掘壕不到水，牧马役亦轻。况乃王师顺，抚养甚分明。送行勿泣血，仆射如父兄。”战哭多新鬼，愁吟独老翁。乱云低薄暮，急雪舞回风。瓢弃尊无绿，炉存火似红。数州消息断，愁坐正书空。
无题·重帏深下莫愁堂,李商隐,重帏深下莫愁堂，卧后清宵细细长。神女生涯原是梦，小姑居处本无郎。风波不信菱枝弱，月露谁教桂叶香。直道相思了无益，未妨惆怅是清狂。十月江南天气好，可怜冬景似春华。霜轻未杀萋萋草，日暖初干漠漠沙。老柘叶黄如嫩树，寒樱枝白是狂花。此时却羡闲人醉，五马无由入酒家。泠泠七弦上，静听松风寒。(七弦 一作：七丝)古调虽自爱，今人多不弹。嗟君此别意何如，驻马衔杯问谪居。巫峡啼猿数行泪，衡阳归雁几封书。青枫江上秋帆远，白帝城边古木疏。圣代即今多雨露，暂时分手莫踌躇。
无题·凤尾香罗薄几重,李商隐,凤尾香罗薄几重，碧文圆顶夜深缝。扇裁月魄羞难掩，车走雷声语未通。曾是寂寥金烬暗，断无消息石榴红。斑骓只系垂杨岸，何处西南任好风。(任 一作：待)暮投石壕村，有吏夜捉人。老翁逾墙走，老妇出门看。(出门看 一作：出看门)吏呼一何怒！妇啼一何苦！听妇前致词：三男邺城戍。一男附书至，二男新战死。存者且偷生，死者长已矣！室中更无人，惟有乳下孙。有孙母未去，出入无完裙。老妪力虽衰，请从吏夜归。急应河阳役，犹得备晨炊。夜久语声绝，如闻泣幽咽。天明登前途，独与老翁别。凄凉宝剑篇，羁泊欲穷年。黄叶仍风雨，青楼自管弦。新知遭薄俗，旧好隔良缘。心断新丰酒，销愁斗几千。中岁颇好道，晚家南山陲。兴来每独往，胜事空自知。行到水穷处，坐看云起时。偶然值林叟，谈笑无还期。
无题·相见时难别亦难,李商隐,相见时难别亦难，东风无力百花残。春蚕到死丝方尽，蜡炬成灰泪始干。晓镜但愁云鬓改，夜吟应觉月光寒。蓬山此去无多路，青鸟殷勤为探看。(蓬山 一作：蓬莱)风急天高猿啸哀，渚清沙白鸟飞回。无边落木萧萧下，不尽长江滚滚来。万里悲秋常作客，百年多病独登台。艰难苦恨繁霜鬓，潦倒新停浊酒杯。少年十五二十时，步行夺得胡马骑。(夺得 一作：夺取)射杀山中白额虎，肯数邺下黄须儿！一身转战三千里，一剑曾当百万师。汉兵奋迅如霹雳，虏骑崩腾畏蒺藜。卫青不败由天幸，李广无功缘数奇。自从弃置便衰朽，世事蹉跎成白首。昔时飞箭无全目，今日垂杨生左肘。路旁时卖故侯瓜，门前学种先生柳。苍茫古木连穷巷，寥落寒山对虚牖。(苍茫 一作：茫茫)誓令疏勒出飞泉，不似颍川空使酒。贺兰山下阵如云，羽檄交驰日夕闻。节使三河募年少，诏书五道出将军。试拂铁衣如雪色，聊持宝剑动星文。愿得燕弓射大将，耻令越甲鸣吾君。莫嫌旧日云中守，犹堪一战取功勋。终南阴岭秀，积雪浮云端。林表明霁色，城中增暮寒。
无题·来是空言去绝踪,李商隐,来是空言去绝踪，月斜楼上五更钟。梦为远别啼难唤，书被催成墨未浓。蜡照半笼金翡翠，麝熏微度绣芙蓉。刘郎已恨蓬山远，更隔蓬山一万重！天际霞光入水中，水中天际一时红。直须日观三更后，首送金乌上碧空。船动湖光滟滟秋，贪看年少信船流。无端隔水抛莲子，遥被人知半日羞。春风先发苑中梅，樱杏桃梨次第开。 荠花榆荚深村里，亦道春风为我来。
无题·飒飒东风细雨来,李商隐,飒飒东风细雨来，芙蓉塘外有轻雷。金蟾啮锁烧香入，玉虎牵丝汲井回。贾氏窥帘韩掾少，宓妃留枕魏王才。春心莫共花争发，一寸相思一寸灰！故人西辞黄鹤楼，烟花三月下扬州。孤帆远影碧空尽，唯见长江天际流。 (唯 通：惟)八月秋高风怒号，卷我屋上三重茅。茅飞渡江洒江郊，高者挂罥长林梢，下者飘转沉塘坳。南村群童欺我老无力，忍能对面为盗贼。公然抱茅入竹去，唇焦口燥呼不得，归来倚杖自叹息。俄顷风定云墨色，秋天漠漠向昏黑。布衾多年冷似铁，娇儿恶卧踏里裂。床头屋漏无干处，雨脚如麻未断绝。自经丧乱少睡眠，长夜沾湿何由彻！安得广厦千万间，大庇天下寒士俱欢颜！风雨不动安如山。呜呼！何时眼前突兀见此屋，吾庐独破受冻死亦足！(亦足 一作：意足)　　从小丘西行百二十步，隔篁竹，闻水声，如鸣珮环，心乐之。伐竹取道，下见小潭，水尤清冽。全石以为底，近岸，卷石底以出，为坻，为屿，为嵁，为岩。青树翠蔓，蒙络摇缀，参差披拂。(珮 通：佩)　　潭中鱼可百许头，皆若空游无所依，日光下澈，影布石上。佁然不动，俶尔远逝，往来翕忽，似与游者相乐。(下澈 一作：下彻)　　潭西南而望，斗折蛇行，明灭可见。其岸势犬牙差互，不可知其源。　　坐潭上，四面竹树环合，寂寥无人，凄神寒骨，悄怆幽邃。以其境过清，不可久居，乃记之而去。　　同游者：吴武陵，龚古，余弟宗玄。隶而从者，崔氏二小生，曰恕己，曰奉壹。
无题·昨夜星辰昨夜风,李商隐,昨夜星辰昨夜风，画楼西畔桂堂东。身无彩凤双飞翼，心有灵犀一点通。隔座送钩春酒暖，分曹射覆蜡灯红。嗟余听鼓应官去，走马兰台类转蓬。不见李生久，佯狂真可哀。世人皆欲杀，吾意独怜才。敏捷诗千首，飘零酒一杯。匡山读书处，头白好归来。茶。香叶，嫩芽。慕诗客，爱僧家。碾雕白玉，罗织红纱。铫煎黄蕊色，碗转曲尘花。夜后邀陪明月，晨前独对朝霞。洗尽古今人不倦，将知醉后岂堪夸。君知妾有夫，赠妾双明珠。感君缠绵意，系在红罗襦。妾家高楼连苑起，良人执戟明光里。知君用心如日月，事夫誓拟同生死。还君明珠双泪垂，恨不相逢未嫁时。(恨不 一作：何不)
春雨,李商隐,怅卧新春白袷衣，白门寥落意多违。红楼隔雨相望冷，珠箔飘灯独自归。远路应悲春晼晚，残宵犹得梦依稀。玉珰缄札何由达，万里云罗一雁飞。故国三千里，深宫二十年。一声何满子，双泪落君前。自倚能歌日，先皇掌上怜。新声何处唱，肠断李延年。解落三秋叶，能开二月花。过江千尺浪，入竹万竿斜。初月如弓未上弦，分明挂在碧霄边。时人莫道蛾眉小，三五团圆照满天。
筹笔驿,李商隐,猿鸟犹疑畏简书，风云常为护储胥。徒令上将挥神笔，终见降王走传车。管乐有才原不忝，关张无命欲何如？他年锦里经祠庙，梁父吟成恨有余。弯弓征战作男儿，梦里曾经与画眉。 几度思归还把酒，拂云堆上祝明妃。万艘龙舸绿丝间，载到扬州尽不还。应是天教开汴水，一千余里地无山。尽道隋亡为此河，至今千里赖通波。若无水殿龙舟事，共禹论功不较多。永巷长年怨绮罗，离情终日思风波。湘江竹上痕无限，岘首碑前洒几多。人去紫台秋入塞，兵残楚帐夜闻歌。朝来灞水桥边问，未抵青袍送玉珂。
锦瑟,李商隐,锦瑟无端五十弦，一弦一柱思华年。庄生晓梦迷蝴蝶，望帝春心托杜鹃。沧海月明珠有泪，蓝田日暖玉生烟。此情可待成追忆？只是当时已惘然。九曲黄河万里沙，浪淘风簸自天涯。如今直上银河去，同到牵牛织女家。众鸟高飞尽，孤云独去闲。相看两不厌，只有敬亭山。(只有 一作：唯有)火山六月应更热，赤亭道口行人绝。知君惯度祁连城，岂能愁见轮台月。脱鞍暂入酒家垆，送君万里西击胡。功名祗向马上取，真是英雄一丈夫。
隋宫,李商隐,紫泉宫殿锁烟霞，欲取芜城作帝家。玉玺不缘归日角，锦帆应是到天涯。于今腐草无萤火，终古垂杨有暮鸦。地下若逢陈后主，岂宜重问后庭花。抛掷南阳为主忧，北征东讨尽良筹。时来天地皆同力，运去英雄不自由。千里山河轻孺子，两朝冠剑恨谯周。唯余岩下多情水，犹解年年傍驿流。少年佳节倍多情，老去谁知感慨生。不效艾符趋习俗，但祈蒲酒话升平。鬓丝日日添头白，榴锦年年照眼明。千载贤愚同瞬息，几人湮没几垂名。支离东北风尘际，漂泊西南天地间。三峡楼台淹日月，五溪衣服共云山。羯胡事主终无赖，词客哀时且未还。庾信平生最萧瑟，暮年诗赋动江关。
送魏万之京,李颀,朝闻游子唱离歌，昨夜微霜初渡河。鸿雁不堪愁里听，云山况是客中过。关城树色催寒近，御苑砧声向晚多。(树 一作：曙)莫见长安行乐处，空令岁月易蹉跎。烽火城西百尺楼，黄昏独上海风秋。(独上 一作：独坐)更吹羌笛关山月，无那金闺万里愁。琵琶起舞换新声，总是关山旧别情。撩乱边愁听不尽，高高秋月照长城。关城榆叶早疏黄，日暮云沙古战场。表请回军掩尘骨，莫教兵士哭龙荒。青海长云暗雪山，孤城遥望玉门关。黄沙百战穿金甲，不破楼兰终不还。大漠风尘日色昏，红旗半卷出辕门。前军夜战洮河北，已报生擒吐谷浑。胡瓶落膊紫薄汗，碎叶城西秋月团。明敕星驰封宝剑，辞君一夜取楼兰。玉门山嶂几千重，山北山南总是烽。人依远戍须看火，马踏深山不见踪。庾信文章老更成，凌云健笔意纵横。今人嗤点流传赋，不觉前贤畏后生。王杨卢骆当时体，轻薄为文哂未休。尔曹身与名俱灭，不废江河万古流。纵使卢王操翰墨，劣于汉魏近风骚。龙文虎脊皆君驭，历块过都见尔曹。才力应难夸数公，凡今谁是出群雄。或看翡翠兰苕上，未掣鲸鱼碧海中。不薄今人爱古人，清词丽句必为邻。窃攀屈宋宜方驾，恐与齐梁作后尘。未及前贤更勿疑，递相祖述复先谁。别裁伪体亲风雅，转益多师是汝师。世间荣落重逡巡，我独丘园坐四春。纵使有花兼有月，可堪无酒又无人。青袍似草年年定，白发如丝日日新。欲逐风波千万里，未知何路到龙津。
咏怀古迹·其一,杜甫,支离东北风尘际，漂泊西南天地间。三峡楼台淹日月，五溪衣服共云山。羯胡事主终无赖，词客哀时且未还。庾信平生最萧瑟，暮年诗赋动江关。月落乌啼霜满天，江枫渔火对愁眠。姑苏城外寒山寺，夜半钟声到客船。海畔尖山似剑铓，秋来处处割愁肠。 若为化得身千亿，散上峰头望故乡。联步趋丹陛，分曹限紫微。晓随天仗入，暮惹御香归。白发悲花落，青云羡鸟飞。圣朝无阙事，自觉谏书稀。
咏怀古迹·其二,杜甫,摇落深知宋玉悲，风流儒雅亦吾师。怅望千秋一洒泪，萧条异代不同时。江山故宅空文藻，云雨荒台岂梦思。最是楚宫俱泯灭，舟人指点到今疑。为有云屏无限娇，凤城寒尽怕春宵。 无端嫁得金龟婿，辜负香衾事早朝。吾爱孟夫子，风流天下闻。红颜弃轩冕，白首卧松云。 醉月频中圣，迷花不事君。高山安可仰，徒此揖清芬。虢国夫人承主恩，平明骑马入宫门。却嫌脂粉污颜色，淡扫蛾眉朝至尊。
咏怀古迹·其三,杜甫,群山万壑赴荆门，生长明妃尚有村。一去紫台连朔漠，独留青冢向黄昏。画图省识春风面，环珮空归夜月魂。(夜月 一作：月夜)千载琵琶作胡语，分明怨恨曲中论。孤山寺北贾亭西，水面初平云脚低。几处早莺争暖树，谁家新燕啄春泥。乱花渐欲迷人眼，浅草才能没马蹄。最爱湖东行不足，绿杨阴里白沙堤。楚水巴山江雨多，巴人能唱本乡歌。今朝北客思归去，回入纥那披绿罗。湖光秋月两相和，潭面无风镜未磨。遥望洞庭山水翠，白银盘里一青螺。(山水翠 一作：山水色)
咏怀古迹·其四,杜甫,蜀主窥吴幸三峡，崩年亦在永安宫。(窥 一作：征)翠华想像空山里，玉殿虚无野寺中。古庙杉松巢水鹤，岁时伏腊走村翁。武侯祠屋常邻近，一体君臣祭祀同。舍南舍北皆春水，但见群鸥日日来。花径不曾缘客扫，蓬门今始为君开。盘飧市远无兼味，樽酒家贫只旧醅。肯与邻翁相对饮，隔篱呼取尽余杯。匈奴犹未灭，魏绛复从戎。怅别三河道，言追六郡雄。雁山横代北，狐塞接云中。勿使燕然上，惟留汉将功。二龙争战决雌雄，赤壁楼船扫地空。烈火张天照云海，周瑜于此破曹公。君去沧江望澄碧，鲸鲵唐突留馀迹。一一书来报故人，我欲因之壮心魄。
咏怀古迹·其五,杜甫,诸葛大名垂宇宙，宗臣遗像肃清高。三分割据纡筹策，万古云霄一羽毛。伯仲之间见伊吕，指挥若定失萧曹。运移汉祚终难复，志决身歼军务劳。兔丝附蓬麻，引蔓故不长。嫁女与征夫，不如弃路旁。结发为君妻，席不暖君床。暮婚晨告别，无乃太匆忙。君行虽不远，守边赴河阳。妾身未分明，何以拜姑嫜？父母养我时，日夜令我藏。生女有所归，鸡狗亦得将。君今往死地，沉痛迫中肠。誓欲随君去，形势反苍黄。勿为新婚念，努力事戎行。妇人在军中，兵气恐不扬。自嗟贫家女，久致罗襦裳。罗襦不复施，对君洗红妆。仰视百鸟飞，大小必双翔。人事多错迕，与君永相望。见人初解语呕哑，不肯归眠恋小车。 一夜娇啼缘底事，为嫌衣少缕金华。浮云终日行，游子久不至。三夜频梦君，情亲见君意。告归常局促，苦道来不易。江湖多风波，舟楫恐失坠。出门搔白首，若负平生志。冠盖满京华，斯人独憔悴。孰云网恢恢，将老身反累。千秋万岁名，寂寞身后事。
宿府,杜甫,清秋幕府井梧寒，独宿江城蜡炬残。永夜角声悲自语，中天月色好谁看。风尘荏苒音书绝，关塞萧条行路难。已忍伶俜十年事，强移栖息一枝安。汉家旌帜满阴山，不遣胡儿匹马还。愿得此身长报国，何须生入玉门关。八月涛声吼地来，头高数丈触山回。须臾却入海门去，卷起沙堆似雪堆。小山重叠金明灭，鬓云欲度香腮雪。懒起画蛾眉，弄妆梳洗迟。照花前后镜，花面交相映。新帖绣罗襦，双双金鹧鸪。
阁夜,杜甫,岁暮阴阳催短景，天涯霜雪霁寒宵。五更鼓角声悲壮，三峡星河影动摇。野哭千家闻战伐，夷歌数处起渔樵。(千家 一作：几家)卧龙跃马终黄土，人事音书漫寂寥。(音书 一作：依依)清瑟怨遥夜，绕弦风雨哀。孤灯闻楚角，残月下章台。芳草已云暮，故人殊未来。乡书不可寄，秋雁又南回。迢递三巴路，羁危万里身。乱山残雪夜，孤烛异乡人。(异乡人 一作：异乡春)渐与骨肉远，转于僮仆亲。那堪正飘泊，明日岁华新。　　近腊月下，景气和畅，故山殊可过。足下方温经，猥不敢相烦，辄便往山中，憩感配寺，与山僧饭讫而去。　　北涉玄灞，清月映郭。夜登华子冈，辋水沦涟，与月上下。寒山远火，明灭林外。深巷寒犬，吠声如豹。村墟夜舂，复与疏钟相间。此时独坐，僮仆静默，多思曩昔，携手赋诗，步仄径，临清流也。　　当待春中，草木蔓发，春山可望，轻鲦出水，白鸥矫翼，露湿青皋，麦陇朝雊，斯之不远，倘能从我游乎？非子天机清妙者，岂能以此不急之务相邀。然是中有深趣矣！无忽。因驮黄檗人往，不一，山中人王维白。
闻官军收河南河北,杜甫,剑外忽传收蓟北，初闻涕泪满衣裳。却看妻子愁何在，漫卷诗书喜欲狂。白日放歌须纵酒，青春作伴好还乡。即从巴峡穿巫峡，便下襄阳向洛阳。秋浦长似秋，萧条使人愁。客愁不可度，行上东大楼。正西望长安，下见江水流。寄言向江水，汝意忆侬不。遥传一掬泪，为我达扬州。秋浦猿夜愁，黄山堪白头。清溪非陇水，翻作断肠流。欲去不得去，薄游成久游。何年是归日，雨泪下孤舟。秋浦锦驼鸟，人间天上稀。山鸡羞渌水，不敢照毛衣。两鬓入秋浦，一朝飒已衰。猿声催白发，长短尽成丝。秋浦多白猿，超腾若飞雪。牵引条上儿，饮弄水中月。愁作秋浦客，强看秋浦花。山川如剡县，风日似长沙。醉上山公马，寒歌宁戚牛。空吟白石烂，泪满黑貂裘。秋浦千重岭，水车岭最奇。天倾欲堕石，水拂寄生枝。江祖一片石，青天扫画屏。题诗留万古，绿字锦苔生。千千石楠树，万万女贞林。山山白鹭满，涧涧白猿吟。君莫向秋浦，猿声碎客心。逻人横鸟道，江祖出鱼梁。水急客舟疾，山花拂面香。水如一匹练，此地即平天。耐可乘明月，看花上酒船。渌水净素月，月明白鹭飞。郎听采菱女，一道夜歌归。炉火照天地，红星乱紫烟。赧郎明月夜，歌曲动寒川。白发三千丈，缘愁似个长。不知明镜里，何处得秋霜。秋浦田舍翁，采鱼水中宿。妻子张白鹇，结罝映深竹。桃波一步地，了了语声闻。黯与山僧别，低头礼白云。月黑雁飞高，单于夜遁逃。欲将轻骑逐，大雪满弓刀。国破山河在，城春草木深。感时花溅泪，恨别鸟惊心。烽火连三月，家书抵万金。白头搔更短，浑欲不胜簪。
